id,type,sectionId,sectionName,webPublicationDate,webTitle,webUrl,body,dateTimeLocal
world/2019/sep/19/thursday-briefing-trudeau-apologises-for-brownface-picture,article,world,World news,2019-09-19 05:20:28+00:00,Thursday briefing: Trudeau apologises for 'brownface' picture,https://www.theguardian.com/world/2019/sep/19/thursday-briefing-trudeau-apologises-for-brownface-picture,"Top story: Trudeau unfit to govern, says rival 
Good morning briefers. I’m Martin Farrer and I’m bringing you the top news stories this morning from home and abroad. 
Justin Trudeau has apologised after a photograph emerged of him wearing brownface makeup at a fancy dress party when he was a young teacher. The Canadian prime minister said he “deeply regrets” the incident at the school in Vancouver in 2001. “It was something I should not have done,” he said. “I didn’t think it was racist at the time, but now I see, it was a racist thing to do.” He also admitted to doing the same on another occasion to sing the Harry Belafonte song, Day O. “Obviously I regret that I did it,” he said. “I’m pissed off at myself, obviously.” He told reporters he had made numerous calls to friends and colleagues – and expected to make more on Thursday. 
The timing of the picture’s release by Time magazine comes as Trudeau seeks reelection next month in what was already a very tight race. His conservative opponent, Andrew Scheer, has consistently used the prime minister’s ethical lapses to attack Trudeau and he seized on the blackface picture, saying his rival was “unfit to govern”. 
 
  
  
   
  
  
 
* * * 
Royal eyebrow – David Cameron has admitted that he sought the Queen’s intervention when polls showed that Scottish nationalists might win the 2014 Scottish independence referendum. The former prime minister says in the BBC’s The Cameron Years documentary next week that he had not asked for anything improper, “just a raising of the eyebrow, even you know a quarter of an inch, we thought would make a difference”. Shortly afterwards, the Queen was reported as telling churchgoers near Balmoral that people should “think carefully” about voting to split from the UK. 
* * * 
‘An emergency’ – A majority of the public believe the climate crisis is the gravest problem facing the world and that politicians are not doing enough to tackle it, according to a survey carried out in eight countries. As millions of people around the world prepare to flock to what are expected to be the biggest climate protests ever seen tomorrow, the survey shows that the climate breakdown is ranked above migration, terrorism and the global economy in the UK, France, Germany, Italy, Poland, Brazil and Canada. Only in the US does it not have top billing, coming in behind terrorism and affordable healthcare. It comes as the teenage activist, Greta Thunberg, urged US Congress to “listen to the scientists” and take some action. 
 
  
  
  Greta Thunberg at the US Congress. 
  Photograph: Kevin Lamarque/Reuters 
  
 
* * * 
Brexit catchup 
&gt; The EU has given Boris Johnson two weeks to formulate a plan to overcome the Irish backstop problem or “it’s over”. Although it is still not clear what the backstop solution might be, we were given a clue of sorts when it emerged that Johnson, on his chaotic visit to Luxembourg on Monday, had allegedly been surprised at how many border checks would be needed in Ireland. Add that to the homework list. 
&gt; Democratic Unionist leader Arlene Foster indicated yesterday that she might accept a bespoke border solution for Northern Ireland to overcome the backstop problem. Her party has previously resisted having different rules from the rest of the UK. 
&gt; There was a neat soundbite at the second day of the supreme court hearing into the prorogation of parliament. Aidan O’Neill QC, a Scottish advocate opposed to the suspension, said Johnson’s government is unworthy of trust because it conspired to ensure that “the mother of parliaments” was closed down by “the father of lies”. It’s the last day of the hearings today. 
&gt; Labour MPs and activists are set for their own Brexit battle at next week’s conference in Brighton. Many are unhappy about Jeremy Corbyn’s plan to try to stay neutral on the issue in any election campaign and want the party to commit to a remain stance. The party is also reportedly going to review the language of Tony Blair’s landmark Clause IV reforms next week. 
* * * 
The last harrumph – Mornings will never be the same again when rottweiler-in-chief John Humphrys steps down from the Today programme after an epic 32-year stint. Colleagues share their memories of the presenter whose gladiatorial style has earned him as many brickbats as plaudits, but who has defined an era of more confrontational journalism. James Naughtie says working with Humphrys was “never dull and always exhilarating” while former Radio 4 controller Mark Damazer says the 76-year-old’s “fearlessness” had been “of incalculable value”. And finally, here are some of harrumphing Humph’s famous highs and lows. 
* * * 
China’s Loch Ness monster? – There was great excitement in China this week after pictures circulated on social media showing what appeared to be some sort of giant sea creature in the Yangtze river. There was speculation that a Loch Ness-style monster could have been spawned by pollution in the giant waterway. But, alas, the reality is more prosaic after it was established that the “creature – dubbed the Three Gorges Water Monster” – was actually a 20m-long industrial airbag. 
Today in Focus podcast: Teenagers trapped by the county lines 
Aamna Mohdin tells Anushka Asthana how county lines gangs are stepping up their operations by using short-term holiday flats and recruiting local teens to sell drugs in small towns around Britain. Plus Owen Jones on Jeremy Corbyn’s ‘neutral’ stance on Brexit. 
 
  
  
   
  
  
 
Lunchtime read: Turbot? Okra? What’s your least favourite food? 
 
  
 
Despite the explosion in exotic dishes and ingredients available at British restaurants in recent years, it seems there are some that not even our leading chefs like that much. We’ve spoken to some of them and gleaned an idea of how people on the other side of the kitchen divide feel about globe artichoke (“faffy”), turbot (“that mucus is absolutely disgusting”) and even coriander (“it gets everywhere”). For Jason Atherton, chef-proprietor of the Social Company restaurants, okra is the worst of the lot. “Okra is the most foul thing ever grown,” he says. “I refuse to work with it. If I see it in a dish, I ask for it to be removed.” 
Sport 
Mauricio Pochettino accused his Tottenham players of lacking fight in the 2-2 Champions League draw at Olympiakos and suggested that they needed to work harder on the psychological side of their game. Ilkay Gündogan scored the pick of the goals as Manchester City eased to a 3-0 away victory over Shakhtar Donetsk, while Ángel Di María scored twice against his former club and Gareth Bale had a goal ruled out by VAR as Paris St-Germain beat Real Madrid 3-0. Wales have a readymade replacement for Rob Howley, who has left Japan after a suspected breach of World Rugby’s betting regulations, but pre-World Cup upheaval rarely bodes well, writes Paul Rees. The culture secretary has called for top women’s sport to be added to televised sport’s “crown jewels” list, which would guarantee them exposure to potentially mass audiences on free-to-air television that men’s tournaments currently enjoy. And the death of Fernando Ricksen, the former Rangers and Netherlands player, has brought to a close a six-year battle with motor neurone disease. 
Business 
Asian markets have edged higher after the decision by the US Federal Reserve to cut its main interest rate by 0.25%. The widely expected move was largely priced in by investors. The FTSE100 is seen opening down this morning while the pound is buying £1.248 and €1.130. 
The papers 
 
  
 
The Express leads with “EU demands: show Brexit plan in 12 days or ‘it’s over’”, the Telegraph says “Rees-Mogg urges Farage supporters to return to the Tory fold” and the Times reports on debates around Labour’s constitution: “Labour starts to reverse Blair’s Clause 4 reforms”. 
The Guardian has: “Saudis to Trump: here’s our proof – now world must respond to Iran”, while the FT says: “Fed rate cut follows second bid to ease overnight lending squeeze”. The Mirror claims the murders of four women resemble the killings committed by Christopher Halliwell: “Confession killer: ‘4 more victims’” and the Sun has: “Loch yes monster!”, reporting that a huge “eel-like creature” has been filmed which the paper says experts believe “really is the monster”. 
The i leads with a story that there has been a surge of HIV tests after former rugby star Gareth Thomas went public with his condition: “‘Have the courage to speak out. Don’t be afraid’”, the paper quotes him as saying. 
Sign up 
 
  
 
The Guardian morning briefing is delivered to thousands of inboxes bright and early every weekday. If you are not already receiving it by email, you can sign up here. 
For more news: www.theguardian.com",2019-09-19 07:20:28+02:00
us-news/2019/sep/19/us-briefing-greta-thunberg-justin-trudeau-trump-whistleblower,article,us-news,US news,2019-09-19 10:09:07+00:00,"US briefing: Greta Thunberg, Justin Trudeau and a Trump whistleblower",https://www.theguardian.com/us-news/2019/sep/19/us-briefing-greta-thunberg-justin-trudeau-trump-whistleblower,"Subscribe now to receive the morning briefing by email. 
Good morning, I’m Tim Walker with today’s essential stories. 
Climate ‘seen as most important political issue’ by public 
The climate campaigner Greta Thunberg has urged US lawmakers to “listen to the scientists” as she joined other young activists in testifying before Congress on Thursday, before Friday’s global climate strikes and the UN climate summit in New York. The Swedish teenager told the hearing she had prepared no remarks of her own, and instead submitted last year’s landmark IPCC report, which warned of an imminent climate catastrophe. 
 
 Global poll. A majority of the public in eight countries including the US and UK sees the climate crisis as the most pressing political issue of the day, ahead of migration or terrorism, according to a poll. 
 Halving emissions. Greenhouse gas emissions could be halved by 2030 if a small number of trends and renewable energy technologies are adopted more widely, according to a report by an international group of experts. 
 
Trudeau apologises after brownface photo emerges 
 
  
  
   
  
  
 
The Canadian prime minister has apologised for wearing brownface to a party when he was a teacher in 2001, admitting “it was a racist thing to do”. A photograph of the then-29-year-old Justin Trudeau, dressed as Aladdin for an Arabian Nights-themed gala at a private school in Vancouver, originally appeared in a school yearbook and was republished this week by Time magazine. “I regret it deeply. I’m deeply sorry I did that, I should have known better,” he said. 
 
 Election campaign. The controversy could prove a turning point for Canada’s general election campaign, in which Trudeau is battling for his political life. His main opponent, the Conservative leader Andrew Scheer, said the photo proved Trudeau was “unfit” to lead Canada. 
 
Whistleblower’s ‘urgent concern’ over Trump pledge – report 
 
  
  
  The president reportedly made a troubling promise to a foreign leader in a phone call. 
  Photograph: Shawn Thew/EPA 
  
 
Donald Trump made a promise to a foreign leader in a phone call that so troubled a US intelligence official that they filed a whistleblower complaint deemed of “urgent concern”, according to a report by the Washington Post. The newspaper did not identify the official, the foreign leader nor the president’s alleged pledge. But the complaint was considered sufficiently pressing by the intelligence community inspector general, Michael Atkinson, to be shared with congressional oversight committees. 
 
 Intelligence committee. However, the acting director of national intelligence, Joseph Maguire, refused to share details about the complaint with lawmakers, the Post reported. He and Atkinson are due to discuss the matter with the House intelligence committee. 
 
How US senators invest in firms they are meant to regulate 
 
  
  
  Democrat Joe Manchin, the ranking member on the Senate energy and natural resources committee, has investments worth millions in his family coal business. 
  Photograph: Mary Calvert/Reuters 
  
 
An investigation by the Guardian in partnership with the news website Sludge has revealed millions of dollars of investments by US senators in sectors on which they set policy. The analysis of recent personal financial disclosure data found that 51 senators and their spouses have up to $96m personally invested in corporate stocks in defense, communications, health, finance, real estate and energy, which together represent a staggering conflict of interest. 
 
 Banking investments. Senators have investments in more than 300 firms, including Apple, ExxonMobil, Verizon and Boeing. Ten members of the Senate banking committee, including Republicans and Democrats, are personally invested in the financial companies they oversee. 
 
Cheat sheet 
 
 A weakened Benjamin Netanyahu has invited his main political rival, Benny Gantz, to join him in forming a unity government, after Gantz’s Blue and White party gained one more seat than Netanyahu’s Likud at Tuesday’s Israeli election. 
 Three former executives at the firm that runs the Fukushima Daiichi power plant have been acquitted of failing to prevent its 2011 nuclear meltdown, after arguing they could not have foreseen the tsunami that triggered the disaster. 
 Contaminated tap water causes 100,000 cancer cases in the US over a lifetime, according to a study. It says most of the risk comes from naturally occurring arsenic, byproducts of chemicals used to disinfect water, and radioactive contaminants. 
 Ten women have now accused the Walt Disney Company of gender discrimination, as part of a lawsuit alleging various divisions of the company systematically fail to promote women and pay them lower salaries than men doing equivalent work. 
 
Must-reads 
 
  
  
  Emmy contenders Julia Louis-Dreyfus (Veep), Emilia Clarke (Game of Thrones) and Jared Harris (Chernobyl). 
  Illustration: Erum Salam/The Guardian 
  
 
Predicting the winners of the 2019 Emmys 
Will Game of Thrones clean up at the Emmys on Monday despite a divisive final season? Could Phoebe Waller-Bridge make history with wins for Fleabag and Killing Eve? Adrian Horton predicts who will win what, and who ought to win instead. 
Why can’t we agree on what’s true anymore? 
Technology encourages us to believe we can all have first-hand access to the facts. Instead, it has left us more uncertain than ever of the truth. William Davies says it’s not all about foreign trolls, filter bubbles or fake news – we have simply become incapable of agreeing on objective reality. 
The war on unwanted dick pics 
When the web developer Kelsey Bressler found an unwanted “dick pic” in her Twitter DMs, she solicited hundreds more and used them to build a filter that recognises a penis and prevents it reaching her inbox. Adrienne Matei asks why tech firms haven’t done the same. 
The 50 best video games of the 21st century 
From karaoke to car theft, the Guardian’s round-up of the greatest culture of the past two decades nears its end with our experts’ selection of the 50 best video games of the era. What, no Candy Crush? 
Opinion 
When some of the world’s wealthiest people attended a climate conference in Sicily in July, they arrived in 114 private jets and a fleet of mega-yachts. Even when they mean well, says George Monbiot, the ultra-rich cannot help but trash the environment. 
 
 Perhaps the most radical thing we can now do is to limit our material aspirations. The assumption on which governments and economists operate is that everyone strives to maximise their wealth. If we succeed in this task, we inevitably demolish our life support systems. 
 
Sport 
Spurs threw away a two-goal lead to draw 2-2 with Olympiakos in the first game of their Champions League campaign, while Manchester City got off to a winning start with a 3-0 victory over Shakhtar Donetsk. Real Madrid lost out to a dominant PSG, but their local rivals Atlético came back to draw 2-2 with Juventus. 
The district attorney’s office in Pennsylvania’s Allegheny County, which encompasses Pittsburgh, has said it will not prosecute the Patriots wide receiver Antonio Brown over sexual assault accusations because of the statute of limitations. Brown’s former trainer is bringing a civil lawsuit against the player, claiming he assaulted her in 2017, when he was with the Steelers. 
Sign up 
The US morning briefing is delivered to thousands of inboxes every weekday. If you’re not already signed up, subscribe now. 
 
  
 
  Sign up for the US morning briefing
  
",2019-09-19 12:09:07+02:00
australia-news/2019/sep/20/morning-mail-climate-strike-trudeau-blackface-bird-extinctions,article,australia-news,Australia news,2019-09-19 21:00:52+00:00,"Morning mail: climate strike, Trudeau blackface, bird extinctions",https://www.theguardian.com/australia-news/2019/sep/20/morning-mail-climate-strike-trudeau-blackface-bird-extinctions,"Good morning, this is Richard Parkin bringing you the main stories and must-reads on Friday 20 September. Top stories More than 250 Australian academics have publicly backed school climate strikes around the country, telling schoolchildren civil disobedience is required to “defend life itself” in the face of political inaction. Tens of thousands are expected to march at more than 100 locations across Australia today, with professors and researchers writing that it is “unconscionable” that current and future generations will have to bear the “terrifying brunt of this unprecedented disaster”. “When a government wilfully abrogates its responsibility to protect its citizens from harm and secure the future for generations to come, it has failed in its most essential duty of stewardship,” the open letter states. Follow coverage of the strikes throughout the day on our live blog, from 8.15am AEST. A third blackface incident involving Justin Trudeau has been revealed, just hours after the Canadian prime minister apologised “profoundly” for wearing what he described as “racist” makeup to a costume party in 2001. The latest images came in a short, undated video clip published by Global News in which Trudeau – his face, arms and legs painted black – waves at the camera and sticks out his tongue. The opposition Conservative party – now neck-and-neck with Trudeau’s Liberals with an election weeks away – confirmed it had sent the video to Global News. The immigration services provider Serco has been awarded a tender worth nearly $10m by the Australian government to return non-citizens to their home countries, despite the UN already providing such a service. Costing $415,000 a month for the next two years, Serco’s assisted returns program has drawn criticism from refugee advocates, given historic allegations of mistreatment during the company’s management of offshore detention centres.  World     A burrowing owl near Calipatria, California. A study has revealed the shocking extent of bird losses in North America. Photograph: David McNew/Getty Images    The US and Canada have lost more than one in four birds since 1970 – a total of 3bn – culminating in what scientists who published a new study are calling a “widespread ecological crisis”. Britain’s supreme court has been urged to back parliament’s recall next week, as a three-day emergency hearing into the legality of Boris Johnson’s proroguing of parliament concluded. The judgment will be handed down early next week. Benjamin Netanyahu’s opponent Benny Gantz has rejected a power-sharing agreement in Israel, declaring that he should lead the next government. Lawyers in the Netherlands have been given emergency protection after the murder of a top defence lawyer, amid media claims the country is descending into a narco-state. The US secretary of state, Mike Pompeo, has cooled rhetoric against Iran, saying Washington is seeking a “peaceful resolution” of tensions with Saudi Arabia. Opinion and analysis     An installation view of Kaws: Companionship in the Age of Loneliness at NGV International, in Melbourne. Photograph: Tom Ross    After a painting that was essentially “a riff on a riff” sold for $14.8m, the art world was quick to round on its creator as “conceptually bankrupt”. But is there more to the artist known as Kaws than just a pop culture craze, asks Steph Harmon. “The figures are often talked about as cartoon or fun or whatever … but I think he’s responding very clearly to the rise of loneliness in our society,” says the curator Simon Maidment, as the National Gallery of Victoria launches a 25-year retrospective, including more than 100 works by the artist. Brigid Delaney is travelling through Mongolia. She sits with nomads, eats their food, drinks cheap vodka and swims in lakes. Everything is going well, until ... “I’m lying … on a camp bed as hard as a door frame, when I get a sharp, stabbing pain in my abdomen. It’s like my digestive tract is studded in razor blades (similar to those rumours about razor blades on the waterslides at fun parks in the 1980s) and I’m trying to digest Mongolia’s biggest chunk of mutton. My stomach is making gurgling noises like ... like … something is trying to escape.” Sport Arsenal have demolished Eintracht Frankfurt in the Europa League, bouncing back from a disappointing performance in the Premier League against Watford, with their young stars spearheading a 3-0 win in Germany. The Rugby World Cup has always been a tournament that demands consistency above all else. Yet the evenness of this year’s competition throws up the real possibility of a team losing a pool game and still managing to win, writes Bret Harris. Thinking time: Pop music’s constant need for ‘new stuff’     Pop albums are being released at an explosive pace Composite: None    The studio album was once the pop industry’s most valued commodity, with the US music industry earning 92.3% of its revenue in 2000 from the sale of CD albums. While albums were released in the 1950s and 60s at the same breakneck pace as singles, driven in part by the immense commercial success of bands like the Beatles, by the 70s the rise of the LP changed “how we perceive and remember what was once the most evanescent of the arts”, according to the famed critic Robert Christgau. With stars like Ariana Grande releasing new albums just six months after their last, and even indie acts such as Foals and Big Thief producing new music at a prolific rate, quick is back. But what’s behind the explosive pace of production? Aimee Cliff takes a closer look. Media roundup Australian federal police have heard eyewitness testimony implicating special forces soldiers in murder, the Sydney Morning Herald reports, with detectives travelling to Afghanistan to investigate allegations of war crimes. The peak body representing sports players globally has called for drastic overhaul of anti-doping regulations, writes the West Australian, claiming they have a “devastating impact on players’ lives”. And the Courier-Mail says Indonesia’s new laws criminalising consensual sex between unmarried adults could put 1.2 million Australians at risk of jail terms. Coming up Students and their supporters around Australia will take part in the global climate strike. Scott Morrison arrives in the US for his official visit, which includes a state dinner at the White House hosted by Donald Trump. Sign up If you would like to receive the Guardian Australia morning mail to your email inbox every weekday, sign up here.",2019-09-19 23:00:52+02:00
