id,type,sectionId,sectionName,webPublicationDate,webTitle,webUrl,body,dateTimeLocal
world/2020/apr/20/nova-scotia-shooting-latest-death-toll-trudeau-response,article,world,World news,2020-04-20 18:36:56+00:00,Nova Scotia shooting  death toll rises as Trudeau calls on Canadians to stand united,https://www.theguardian.com/world/2020/apr/20/nova-scotia-shooting-latest-death-toll-trudeau-response,"Justin Trudeau has called on Canadians to stand unified in the face “senseless violence” as the confirmed death toll from the country’s deadliest mass shooting rose to 19 people, including the gunman. “No one man’s action can build a wall between us and a better day, no matter how evil, how thoughtless or how destructive,” the prime minister said on Monday morning. “As families grieve the loss of a loved one, all Canadians are standing with them.”   Related: Nova Scotia shooting: shock and surprise at killings by denturist    The Royal Canadian Mounted Police (RCMP) revised the death toll of the weekend shooting upwards on Monday and said they anticipated finding more victims from the rampage, which lasted for at least 12 hours. “I know this is a challenging time for Nova Scotians and that there are so many unanswered questions. I want to reassure you that we are working hard to find out as much information as possible in the days and weeks to come,” said Chris Leather, the RCMP chief superintendent, adding that officers were currently examining 16 crime scenes. “We will be in this for months to come.” Police said Gabriel Wortman, a 51-year-old denturist, disguised himself as a police officer before his first attack in the coastal town of Portapique on Saturday evening. The victims included a teacher, nurse, police officer, social worker and three married couples. Wortman was shot dead by police following a standoff late Sunday morning. With Nova Scotia already in lockdown in order to contain the spread of the coronavirus, Trudeau acknowledged the grieving process would be especially difficult, announcing a virtual Facebook vigil on Friday at 7pm.   graphic   “We are a country that stands united in our effort to defeat a pandemic, save lives and to help each other make it to a better day,” he said. “But yesterday we were jolted from that common cause by the senseless violence and tragedy.” The chaos began late Saturday evening, when police responded to emergency calls in Portapique. Residents told local media that Wortman set fire to numerous properties – including his own – and shot people fleeing for safety. Officers found “several casualties” inside and outside at a house in Portapique at 11.30pm, but couldn’t locate a suspect. On Monday, police said they anticipated finding additional victims in the remains of buildings that were burned down. Authorities haven’t yet determined a motivation for the attacks, but the fact that Wortman had created a replica RCM vehicle and “either a real uniform or a perfect facsimile” suggested his early actions were deliberate, said Leather. “His ability to move around the province undetected was surely greatly benefited by the fact that he had a vehicle that looked identical in every way to a marked police car,” Leather said. One resident told the Globe and Mail that Wortman arrived at his house Sunday morning, dressed as a police officer and driving what appeared to be a police car. Brandishing a pistol and rifle, Wortman began pounding on the door. “He came here to kill me,” the man told the Globe and Mail. “There’s no question about that.” The man and his wife hid until Wortman left. “He wasn’t killing enemies, he was killing his friends,” he said. “He was trying to beat down our door. It was beyond terrifying.” Wortman eventually swapped his police cruiser replica for a silver SUV on Sunday, leading police in a chase down a busy highway, culminating in a fatal shootout at a gas station in the town of Enfield. On Monday, police faced questions over why they didn’t send out text alerts to warn residents of an active shooter in the region, instead relying on Twitter to keep the public updated. Many rural communities in the province lack access to high-speed internet.     Constable Heidi Stevenson, one of the victims who had served on the force for 23 years. Photograph: Rcmp Halifax/EPA    Police said the victims included a police officer who was shot after responding to reports of the shooting on Sunday morning. Constable Heidi Stevenson, a mother of two, had served on the force for 23 years. “We have lost one of our own while she was protecting others,” said Leather. “This is the definition of a true hero.” As news of the shootings spread, family members and friends eulogized the victims on social media. Among the dead was Tom Bagley, who was killed as he rushed to help victims. “This beautiful soul was taken from me so unnecessarily. I can’t even comprehend it,” his daughter Charlene wrote on Facebook. Heather O’Brien, a nurse and grandmother from the town Truro in central Nova Scotia, was remembered for her kind spirit.   Related: Nova Scotia shooting: friends and family pay tribute to ‘beautiful souls’ lost in rampage    “The pain comes and goes in waves. I feel like I’m outside of my own body,” wrote her daughter Darcy Dobson, who described texting her mother minutes before she died – and the “monster” that killed her. “I want everyone to remember how kind she was … Let those things define her. Not the horrible way she died.” O’Brien’s niece Megan Brown remembered her aunt as a “healer” and a “bright light”. Greg and Jamie Blair, a husband and wife, were also among those killed. “I have absolutely no words for the heartache my family &amp; many others are going through,” wrote Jessica MacBurnie on Facebook. The couple, married in 2014, leave behind their two children. Lisa McCully, a teacher and mother of two, was also killed during the rampage, according to her sister and the Nova Scotia teacher’s union. “She was somebody who taught from the heart,” said the union president, Paul Wozney. “She taught her kids not just the curriculum but teaching about virtues and personal qualities.” On the Nova Scotia Kitchen Party Facebook group – originally created for residents to connect and sing together during the coronavirus pandemic – members posted tributes to the victims and sang songs, including Amazing Grace.  The massacre in Nova Scotia is the worst of its kind in Canadian history, eclipsing the 1989 École Polytechnique massacre, in which 14 women were killed in Montreal. A man driving a van deliberately ran over and killed 10 people in Toronto in April 2018 and a man shot dead six people at an Islamic cultural centre in Quebec City in 2017. In his remarks on Monday, Trudeau also addressed children living in Nova Scotia. “I know the world can seem like a mean and ugly place right now, but there’s a whole lot of good in the world too. You’ll see it in your neighbours and in Canadians in the days and months ahead,” he said. “This is a difficult time and it can be a scary time too. But we’re here for you and we’re going to get through this together, I promise.” • This article was amended on 21 April 2020. The number of women killed in 1989 at the École Polytechnique was 14, not 15 as an earlier version said. This has been corrected.",2020-04-20 20:36:56+02:00
world/2020/apr/28/canada-trudeau-coronavirus-quebec-ease-lockdown,article,world,World news,2020-04-28 16:43:35+00:00,Trudeau urges caution as Quebec plans to ease lockdown: ‘We’re not out of the woods yet’,https://www.theguardian.com/world/2020/apr/28/canada-trudeau-coronavirus-quebec-ease-lockdown,"Justin Trudeau has urged caution as Canada’s most populous provinces announce plans to ease their lockdown measures, highlighting the challenge of balancing public health recommendations with a growing pressure to loosen coronavirus restrictions. “The measures we’ve taken so far are working. In fact, in many parts of the country the curve has flattened,” Trudeau said on Tuesday. “But we’re not out of the woods yet. We’re in the middle of the most serious public health emergency Canada has ever seen and if we lift measures too quickly, we might lose the progress we’ve made.” Quebec – the hardest-hit region in the country with more than 1,600 deaths – plans to reopen elementary schools and childcare facilities on 11 May. The province has opted to suspend the return of high school until autumn, fearing that 1 million students descending on schools could trigger a second wave of Covid-19 cases. But officials have acknowledged growing concerns the sustained lockdown could have on younger children.   Related: Canada's bid to beat back coronavirus exposes stark gaps between the provinces    “Life must go on,” said the premier, François Legault, adding that parents would not be required to send their children to school and that older teachers with health concerns would be permitted to work from home. On Tuesday afternoon, Quebec is set to announce plans for businesses to reopen. Ontario, in contrast, has taken a far more cautious approach, announcing what the premier, Doug Ford, called a “road map” rather than “calendar” on Monday. “The framework is about how we’re reopening – not when we’re reopening,” said Ford. Unlike Quebec, the province will not name specific dates for when activities such as going to parks or offices can return to normal. Instead, Ontario’s framework is tied to expanded testing, the ability to rapidly trace new outbreaks and a sustained drop in new Covid-19 cases in the province’s hospitals. Ontario has so far recorded nearly 900 deaths from the coronavirus. “Let me be crystal clear: as long as this virus remains a threat to Ontario, we will continue to take every precaution necessary,” said Ford on Monday. Schools will remain closed until at least 31 May, but the province’s education minister, Stephen Lecce, has signalled that closure could extend further. Both Ontario and Quebec, which shut down at roughly the same time in March, have grappled with a high rate of fatalities in long-term care homes , and have requested the federal government send the military to work in understaffed facilities. Other regions of the country, including Saskatchewan, Prince Edward Island and New Brunswick, have emerged largely unscathed from the outbreak, recording five deaths in all three provinces combined. Saskatchewan plans to reopen golf courses and campgrounds in May and New Brunswick will permit physical distancing guidelines to ease in the coming weeks. Canada has recorded nearly 50,000 cases of the virus across the country, with more than 2,700 deaths. On Tuesday, federal officials said previous models had underpredicted the fatality rate of the virus, as Covid-19 takes hold in long-term care facilities in the country. Nearly 80% of deaths in the country have occurred in these facilities. By 5 May, updated forecasting suggests the country will have probably recorded between 3,300 and 3,900 death, said the chief public health officer, Dr Theresa Tam, warning that control measures like physical distancing were still required. “Relaxing controls too early could squander our efforts to date and put us at risk for another outbreak,” she said.",2020-04-28 18:43:35+02:00
world/2020/may/01/canada-assault-weapons-ban-trudeau-nova-scotia-shooting,article,world,World news,2020-05-01 15:40:24+00:00,Trudeau announces Canada is banning assault-style weapons,https://www.theguardian.com/world/2020/may/01/canada-assault-weapons-ban-trudeau-nova-scotia-shooting,"Canada has banned assault-style weapons following the murder of 22 people in the worst mass shooting in the country’s history, Justin Trudeau announced on Friday. 
“These weapons were designed for one purpose and one purpose only: to kill the largest number of people in the shortest amount of time. There is no use and no place for such weapons in Canada,” said the prime minister. “Effective immediately, it is no longer permitted to buy, sell, transport, import or use military-grade assault weapons in this country.” 
After the Nova Scotia shooting last week, Trudeau said his government intended “strengthen gun control” to fulfil a campaign promise to restrict certain weapons – a plan that had initially been derailed by the coronavirus pandemic. 
 
  Related: Twelve hours of terror: how the Nova Scotia shooting rampage unfolded  
 
The Royal Canadian Mounted Police said on Tuesday that the Nova Scotia gunman, Gabriel Wortman, had been armed with two semi-automatic rifles and several semi-automatic pistols. 
Supt Darren Campbell said that one of the guns could be described “military-style assault rifle”. 
The new ban would probably not have stopped Wortman from obtaining his weapons: he did not have a license to possess or purchase firearms, and police have said they believe the guns were obtained illegally in Canada and the United States. 
The prime minister announced a two-year “amnesty period” to allow gun owners to comply with the law. The ban covers 1,500 models and variants of firearms. 
Canada has one of the highest per capita gun ownership rates in the world, at an estimated 34.7 firearms per 100 people, according to the Small Arms Survey in 2018. The country still trails far behind the US, which has close to 120 guns per 100 people. 
While Trudeau promised in 2015 that a Liberal government would make it more difficult for gun owners to acquire certain types of firearms, it wasn’t until the most recent election campaign that the prime minister promised a full ban on “military-style assault weapons” if re-elected. 
“As long as Canadians are losing their loved ones to gun violence, not enough has changed,” Trudeau said in September. “We know you do not need a military-grade assault weapon, one designed to kill the largest amount of people in the shortest amount of time, to take down a deer.” 
At present, the Firearms Act does not make a distinction between “military-style” weapons and other type of long guns – meaning the government would also need to add amend the law. 
Trudeau had also previously promised to ban the Ruger Mini-14 rifle, the weapon used in the 1989 École Polytechnique shooting in Montreal, in which 14 women were murdered. 
The move to heavily restrict access to certain firearms will probably prompt anger from the opposition Conservative party and Canada’s gun lobby – but a ban of certain weapons can be carried out through cabinet, bypassing the need for legislation. 
“Justin Trudeau is using the current pandemic and the immediate emotion of the horrific attack in Nova Scotia to push the Liberals’ ideological agenda to make major firearms policy changes,” said the Conservative leader, Andrew Scheer, following Trudeau’s comments. “Taking firearms away from law-abiding citizens does nothing to stop dangerous criminals who obtain their guns illegally.” 
Ken Price, whose daughter Samantha was hurt in a 2018 mass shooting in Toronto in which two people were killed and 13 injured, said he was “pleased to see movement” on the issue. 
“Having weapons that can be configured so that they inflict massive damage just doesn’t seem like the right thing to do – nor is it reflective of what the average Canadian wants,” he said. “And this still leaves plenty of choice for hunters, fishermen and sport shooters.” 
Price said Canada should also tighten controls on handguns and introduce “red flag laws” – enabling authorities to remove firearms from individuals deemed a risk to themselves or others – but said he was “pleased to see movement” on assault weapons. 
An “overwhelming majority” majority of Canadians – nearly four out of five people – support the ban, according to a poll from the Angus Reid Institute, released Friday.",2020-05-01 17:40:24+02:00
world/2020/may/29/justin-trudeau-george-floyd-reaction-racism,article,world,World news,2020-05-29 18:25:08+00:00,Trudeau: Canadians watching US unrest and police violence in ‘shock and horror’,https://www.theguardian.com/world/2020/may/29/justin-trudeau-george-floyd-reaction-racism,"Canadians are watching unrest and police violence in the United States in “shock and horror”, Justin Trudeau said on Friday – but the prime minister cautioned that his country also has entrenched problems with racism.&nbsp; 
The city of Minneapolis&nbsp;has been rocked by a third night of violent protests over the death of George Floyd, an unarmed black man, after a white police officer knelt on his neck as he lay on the ground following arrest.&nbsp; 
“Many Canadians of diverse backgrounds are watching, like all Canadians are, the news out of the United States with shock and with horror,” Trudeau told reporters at a daily briefing. 
“Anti-black racism – racism – is real. It’s in the United States but it’s also in Canada and we know people are facing systemic discrimination, unconscious bias and anti-black racism every single day,” said Trudeau, calling on the country to “stand together in solidarity” against racial hate. “We have work to do as well in Canada.”&nbsp; 
Racial inequities continue to persist throughout the country – a grim reality that is often apparent during interactions with police.&nbsp; 
In December 2018, the province of Ontario&nbsp;released a landmark report&nbsp;that found black residents in Toronto – the country’s largest city – are 20 times more likely to be shot dead by the police than white residents.&nbsp; 
“It’s a very Canadian tradition to speak in platitudes, to refer to the underground railroad and to speak about Canada as a haven and a place that acknowledges its past mistakes,” said Robyn Maynard, author of&nbsp;Policing Black Lives. “But we continue to see similar structural harms and structural kinds of violence as we do in places where leaders make more overtly vitriolic statements towards black communities.” 
 
  
  
   
  
  
 
Last month, 26-year-old D’Andre Campbell was shot dead by police inside his own home, north of Toronto, after Campbell himself called 911. 
Earlier this week, the family of Regis Korchinski-Paquet said a police officer shoved the young woman over the balcony of the family’s 24th-floor apartment, where she fell to her death. The case is currently under investigation by an arms-length police watchdog. 
Maynard also pointed out the coronavirus pandemic continues to have a disproportionate impact on black and indigenous residents, who are overrepresented in the country’s prison population. 
“We continue to see prisons and jails being epicentres of outbreaks,” she said. “Yet there is failure on the part of the federal government to meaningfully release to release prisoners.” 
Trudeau’s unprompted remarks marked a notable departure for a leader who has gone to great lengths to avoid irritating his US counterpart, Donald Trump. 
 
  Related: Canada is hailed for its tolerance but is it ready to confront its racism?  
 
Canadian prime ministers have traditionally refrained from discussing political and social turmoil in the US – Canada’s main ally and largest trading partner.&nbsp; 
Justin Trudeau has long spoken about the need to tackle racism, but his re-election campaign was marred by pictures of him in blackface as a young man.&nbsp;",2020-05-29 20:25:08+02:00
world/2020/jun/05/justin-trudeau-takes-a-knee-but-is-silent-on-reforms-to-policing,article,world,World news,2020-06-05 23:15:21+00:00,Justin Trudeau takes a knee but is silent on reforms to policing,https://www.theguardian.com/world/2020/jun/05/justin-trudeau-takes-a-knee-but-is-silent-on-reforms-to-policing,"Justin Trudeau took a knee in solidarity with anti-racism demonstrators on Friday, but remained silent at the event as his government faces questions over how it plans to address police violence.&nbsp; 
Wearing a black mask and surrounded by bodyguards, the Canadian prime minister made a surprise appearance at the No justice = No peace rally in Ottawa. 
After he knelt with protesters, a number of attendees thanked him for the gesture. But, for others, Trudeau’s actions&nbsp;rang hollow. 
“I’m not interested in bullshit publicity stunts, especially now,” said Andray Domise, a Toronto-based writer. “How the hell can you kneel against police brutality? When everything in your record indicates you have no problem with it. It boggles the mind to watch him turn to the camera – almost like he was confirming that he was being filmed – and kneeling.” 
The prime minister has previously received criticism for attending demonstrations. In September he joined a climate rally in Montreal, even though his government has been widely criticised by activists for bailing out a contentious pipeline expansion project.&nbsp; 
 
 
  Trudeau takes a knee at BLM rally in Ottawa. Nice gesture but isn't this a cop/protestor thing? Or is it a solidarity thing? Or is it a virtue-signaling thing? Because it's him, I don't know. pic.twitter.com/3c6y6PpKGr— Dean Blundell (@ItsDeanBlundell) 
  June 5, 2020
  
 
Earlier in the day, Trudeau acknowledged the country had problems within its policing systems, following a number of violent incidents – including the killing of Chantel Moore, a 26-year-old Indigenous woman shot dead by police early on Thursday morning.&nbsp; 
“Far too many Canadians feel fear and anxiety at the sight of law enforcement officers,” Trudeau told reporters. “Over the past weeks, we’ve seen a large number of Canadians suddenly awaken to the fact that the discrimination that is a lived reality for far too many of our fellow citizens is something that needs to end.” 
Reporters asked Trudeau to name specific policy changes his government would implement, and if he believed police officers in Canada were racist, but he declined to answer either question directly.&nbsp; 
Earlier in the day, Indigenous Services minister Marc Miller condemned Moore’s killing. “I’m pissed. I’m outraged. There needs to be a full accounting of what has gone on,” he said. This is a pattern that keeps repeating itself.” 
The march in Ottawa, attended by thousands, followed days of protest over police brutality and racism across the US, prompted by the police killings of George Floyd and Breonna Taylor, and the murder of Ahmaud Arbery.&nbsp; 
But activists pointed out that Canada had its own problems with race and policing: black residents of Toronto are 20 times as likely to be shot dead as white residents. 
 
  Related: Canada police under scrutiny after two women die after encounters with officers  
 
At a march in Toronto on Friday, the city’s police chief, Mark Saunders, also took a knee with other officers near police headquarters. 
The city’s police&nbsp;service has come under fire&nbsp;in recent days, after a woman fell to her death following a police response to a mental health emergency. In light of the incident, which police are prohibited from speaking about, Saunders has pledged to expedite the rollout of body cameras on officers. 
The incident closely mirrored an event in the city of London, Ontario last month, when the mother of 27-year-old Caleb Tubila Njoko called police for help after her son displayed erratic behaviour. Police arrived at the apartment and her son fell from the balcony. He died three days later.",2020-06-06 01:15:21+02:00
