id,type,sectionId,sectionName,webPublicationDate,webTitle,webUrl,body,dateTimeLocal
world/2018/oct/10/justin-trudeau-canada-climate-change-fossil-fuels,article,world,World news,2018-10-10 10:00:45+00:00,Canada: Trudeau on back foot as frustration builds over PM's climate strategy,https://www.theguardian.com/world/2018/oct/10/justin-trudeau-canada-climate-change-fossil-fuels,"When Justin Trudeau swept into power in 2015, he pledged to make fighting climate change a top priority for his government. Three years later, Canada’s prime minister is on the defensive, scrambling to both revive his party’s unravelling climate strategy as a growing number of provinces refuse to participate in national carbon tax – and to temper frustrations over his government’s continued investment in the fossil fuel industry. “From the beginning, [the government] decided they were going to try to thread the needle on the need for climate policy and fossil fuel resource development. They even made the two interdependent,” said Matthew Hoffman, a political science professor at Toronto’s Munk School of Global Affairs. But on the surface, the strategy appears to be quickly falling apart.   Related: What if Canada had spent $200bn on wind energy instead of oil?    Trudeau’s political foes have already seized on the carbon tax in anticipation of the upcoming federal election – still a full year away – but the prime minister has shown no signs of backing down. “Pollution should not be free anywhere across this country,” he said last week.  The political infighting comes as the UN’s intergovernmental panel on climate change warned that drastic changes are needed to offset the impacts of global climate change. As part of a strategy to reduce Canada’s emissions, provinces are required to introduce a tax of at least $20 per tonne on emissions from January 2019, with increments of $10 each year until 2022. In provinces which fail to produce an adequate carbon pricing plan, the federal government would implement its own tax, or “backstop”. Last week, Manitoba became the fifth province to publicly opt out of carbon pricing, arguing that its own plans to combat climate change were sufficient. Saskatchewan, which still relies heavily on coal for its power, has called the carbon tax a “ransom note”. In Ontario, Canada’s most populous province, the rightwing premier, Doug Ford, has vowed to rally opposition to the measure, which he described as “the worst tax ever”. Alberta, home to the country’s oil sands, announced it would leave the plan after the federal government failed to push through construction of the Trans Mountain expansion pipeline – a project Alberta argued was critical to its economy. “Until the federal government gets its act together, Alberta is pulling out of the federal climate plan,” said Premier Rachel Notley in August. “And let’s be clear, without Alberta, that plan isn’t worth the paper it’s written on.” Only two provinces, British Columbia and Quebec, have signalled a willingness to remain in some form of carbon pricing agreement. When the original agreement was laid out, many of the provinces had Liberal politicians in power. Now, a conservative wave across the country has changed the party in power – and the political calculus.     Construction on the Kinder Morgan pipeline was halted over the summer. Photograph: Ben Nelms/Reuters    “This is a political move by the provinces. It’s conservatives wanting to give the Liberals a black eye,” said Nelson Wiseman, a professor of Canadian studies at the University of Toronto. “If you ask people, ‘Should the government do something about climate change?’ they’ll say yes. If you ask them, ‘Are you prepared to pay higher taxes?’ they’ll say no.” The recent stumbles, however, could end up being a benefit for Trudeau, argued Mark Cameron, director Clean Prosperity, an environmental thinktank. “If anything, this may end up making the carbon price backstop more effective,” he said. “Instead of one or two provinces that are going to be falling under it, there will be four or five. You’ll be getting a more coherent national carbon pricing system.” Carbon taxes are supposed to be revenue neutral, meaning any increase a person pays are offset elsewhere. With its own carbon tax, the federal government could circumvent antagonistic provincial governments and deliver cheques – as high as $600 per year– to individual households. “The [upcoming federal] election is going to be in October,” said Wiseman. “Imagine, in July, people start getting cheques in the mail!” Experts agree that any plan to fight the tax is probably a losing battle: courts have repeatedly affirmed the right of the government to impose a tax on provinces. “Whether that court victory leads to political victory is another question altogether, said Hoffman. “[Trudeau’s] got to build popular support for this.” As he grapples with carbon pricing, Trudeau is also engaged in a delicate task of placating his environmental supporters over frustrations that oil development is detrimental to emissions reductions.   Related: Hellfire: this is what our future looks like under climate change    Construction on the Trans Mountain pipeline expansion, which the government purchased from Texas-based Kinder Morgan, was halted over the summer by a federal court order, largely the result of inadequate consultations with indigenous communities. The government remains committed to pushing the pipeline through – and recently hired a retired supreme court justice to buttress its consultations with First Nations. “The idea that the environment and the economy are not opposing goals, is a great framing,” said Hoffman. “But it’s tough to do when you’re framing the economy not as a transformed economy in a low-carbon world, but as further exploitation of fossil fuel resources.”",2018-10-10 12:00:45+02:00
world/2018/nov/12/trudeau-says-canada-has-received-turkish-tape-of-khashoggi,article,world,World news,2018-11-12 14:09:41+00:00,Trudeau says Canada has heard Turkish tape of Khashoggi murder,https://www.theguardian.com/world/2018/nov/12/trudeau-says-canada-has-received-turkish-tape-of-khashoggi,"Canada’s prime minister, Justin Trudeau, has become the first western leader to confirm Turkish claims that an audio recording of Jamal Khashoggi’s murder exists and has been passed to intelligence agencies. 
The Turkish president, Recep Tayyip Erdoğan, said he had given recordings “to Saudi Arabia, to America, to the Germans, the French, to the British, to all of them”, but initially there was no independent confirmation from any country that they had heard it. 
Speaking at a press conference in Paris, where he attended a peace forum after armistice ceremonies, Trudeau said Canadian intelligence had listened to the audio tape provided by Turkish intelligence, but he had not done so. 
“Canada’s intelligence agencies have been working very closely on this issue with Turkish intelligence and Canada has been fully briefed on what Turkey had to share,” he said. 
“I had a conversation with Erdoğan a couple of weeks ago, and here in Paris we had brief exchanges and I thanked him for his strength in responding to the Khashoggi situation.” 
In contrast, the French foreign minister, Jean-Yves Le Drian, said recordings related to Khashoggi’s murder were not to his knowledge in France’s possession, directly contradicting Erdoğan. 
Asked on France 2 television why the Turkish president had made the claim, Le Drian replied: “It means he has a political game to play in these circumstances. If the Turkish president has information to give to us, he must give it to us.” 
His remarks were seized on by the Saudi press to imply Erdoğan was misleading the world about the extent of his knowledge of Khashoggi’s killing in an attempt to undermine the Saudi crown prince, Mohammed bin Salman. 
Turkey said the French remarks were unacceptable and not a reflection of the facts. “Let us not forget that this case would have been already covered up had it not been for Turkey’s determined efforts,” said Fahrettin Altun, the Turkish presidency communications director. 
It is thought the British officials have listened to a tape, but not been given possession of it, a state of affairs that would square with Le Drian’s claim that France does not possess the tape. 
Altun said: “I confirm that evidence pertaining to the Khashoggi murder has also been shared with the relevant agencies of the French government.” 
A representative of French intelligence listened to the audio recording and detailed information including a transcript on October 24, he added. “If there is miscommunication between the French government’s various agencies, it is up to the French authorities — not Turkey — to take care of that problem.” 
Steffen Seibert, the spokesman for the German chancellor, Angela Merkel, was asked about the existence of a tape and said: “ I can tell you that there has been an exchange of intelligence service information on that.” He declined to give any further details. 
British sources previously said they had been briefed on the contents of an alleged tape, but due to the sensitivity of intelligence exchanges, they have refused to elaborate. 
Canada has taken a tough line on Saudi Arabia’s human rights record for months, provoking reprisals from Riyadh, including the withdrawal of investment. 
The dispute over the tape is important as it concerns Erdoğan’s credibility. He has been pushing for the west to demand Saudi Arabia hand over the alleged culprits behind the admitted killing. He has also implied that Prince Mohammed was aware of the plot to kill Khashoggi and that it was not a rogue operation undertaken by Saudi intelligence without his knowledge or permission. 
It is not known whether any tape implicates the crown prince or instead simply provides gruesome details of the murder.",2018-11-12 15:09:41+01:00
world/2018/dec/17/canada-saudi-arms-deal-justin-trudeau,article,world,World news,2018-12-17 17:53:41+00:00,Justin Trudeau says Canada is looking to pull out of Saudi arms deal,https://www.theguardian.com/world/2018/dec/17/canada-saudi-arms-deal-justin-trudeau,"Canada is looking for a way to end a multibillon-dollar deal to sell armoured vehicles to Saudi Arabia, according to the prime minister, Justin Trudeau, but the country hasn’t yet figured out how to leave the agreement. “We are engaged with the export permits to try and see if there is a way of no longer exporting these vehicles to Saudi Arabia,” Trudeau told CTV’s Question Period on Sunday, in the latest signal that his government is increasingly likely to terminate the contract.   Related: 'Yemenis are left so poor they kill themselves before the hunger does'    Following the killing of the Saudi journalist Jamal Khashoggi and mounting civilian deaths from the war in Yemen, Trudeau has been under increasing pressure from rights groups, academics and policy advisers to cancel the arms deal. Both Germany and Sweden have cancelled arms contracts with Saudi Arabia following public outrage over the brazen killing of the dissident journalist, but Trudeau has previously said that cancelling the contract would cost the Canadian government billions. Trudeau’s unwillingness to cancel the deal has frustrated arms control activists. “The government has clearly gotten to a point that its most pragmatic staffers and advisers must be convinced that this is too costly for Canada’s reputation,” said Mark Kersten, deputy director of the Wayamo Foundation and author of Justice in Conflict. “But there needs to be a degree of healthy skepticism here. We’ve seen this before with the Trudeau government: they say one thing and either do nothing, or the exact opposite.” The arms deal, initiated under the previous Conservative government in 2014 but continued under the Liberals, supplies the Saudis with light armoured vehicles and is worth C$14.8bn ($19.8bn). At the time, it was the largest export deal in Canada’s history, making the country the second-largest arms exporter to the Middle East.  Kersten called Trudeau’s previous public statements on the deal – that it couldn’t be cancelled and that the deal represented part of Canada’s global reputation – a “comedy of cop-out excuses”. Earlier this year, the Trudeau government was forced into a U-turn on another weapons deal after news broke that an order of helicopters sent to the Philippine president, Rodrigo Duterte, could be potentially used against civilians. The Canadian government has previously approved export licences for military goods to China and Algeria, both nations with poor human rights records. After videos of security forces attacking civilian protesters began circulating in August 2017, the government temporarily suspended permits for armoured vehicles exported to Saudi Arabia. “It comes down to a deceivingly simple question,” said Kersten. “Do we want to be a country that has an arms trade with very unsavoury states, who may actually end up using these very same weapons to commit the kinds of atrocities and rights abuses that Canada has proposed to stand up against?”",2018-12-17 18:53:41+01:00
world/2019/jan/15/china-canada-trudeau-strong-dissatisfaction-detained-man,article,world,World news,2019-01-16 05:14:56+00:00,China expresses 'strong dissatisfaction' with Trudeau as countries spar,https://www.theguardian.com/world/2019/jan/15/china-canada-trudeau-strong-dissatisfaction-detained-man,"China has expressed “strong dissatisfaction” with Justin Trudeau after he criticised the death sentence passed on a Canadian man convicted of drug trafficking, as the two countries continued to spar over detained citizens. The Canadian prime minister should “respect the rule of law, respect China’s judicial sovereignty, correct mistakes and stop making irresponsible remarks”, a foreign ministry spokeswoman, Hua Chunying, said on Tuesday. A day earlier, Trudeau said that the death sentence had been applied “arbitrarily” in the case of Robert Lloyd Schellenberg when it was upped from a 15-year prison sentence on appeal. “We express our strong dissatisfaction with this,” Hua said.   Related: 'Hostage' diplomacy: Canadian's death sentence in China sets worrying tone, experts say    But on Tuesday, Canada showed little sign of backing away from its condemnation of the verdict. “Canada’s position when it comes to the death penalty is consistent and very longstanding,” the foreign minister, Chrystia Freeland, told reporters. “We believe it is inhumane and inappropriate, and wherever the death penalty is considered with regard to a Canadian we speak out against it.” She said Canada’s ambassador, John McCallum, had petitioned China for clemency on behalf of Schellenberg. Schellenberg’s lawyer has said his client plans to appeal. If the appeal is rejected, then the court’s verdict will go to the supreme people’s court in Beijing. If they approve it, the execution could happen within seven days, but the court could also reduce the sentence. Relations between the two countries – which only months before had been in pursuit of a large free trade agreement – turned icy in early December when Canadian authorities arrested Meng Wanzhou, a senior Huawei executive and Chinese citizen, for extradition to the US. On Tuesday, hours after Ottawa issued a travel warning for Canadians in China, Beijing published a similar advisory telling its citizens to “fully evaluate the risks” of traveling in Canada and detailed the “arbitrary detention” of a Chinese national. Chinese state media have defended their government’s actions and penalties for drug smugglers. A Xinhua-affiliated editor posted on his public Wechat account: “Indeed, those who commit sins should not survive. When it comes to drug traffickers, no matter where you come from there is bound to be a bullet waiting for you!” Critics say Beijing is using Schellenberg’s case to exert pressure on Ottawa. But analysts have been confounded by the dramatic deterioration in relations. “I’m mystified by the lack of restraint in the Chinese response. It’s not what I would expect to have from such a serious strategic country, and the Chinese are highly strategic,” said Michael Byers, a political science professor at the University of British Columbia. “In this instance it seems that are allowing anger to get the better of their strategic foresight.” While China has been vocal about Canada’s arrest of Meng on 1 December, Trudeau’s comments in recent days have also been “unhelpful”, said Byers. “He suggested a few days ago that one of the Canadians who has been detained has diplomatic immunity, which is patently false,” he said, adding that Trudeau’s comments that Schellenberg’s detention was “arbitrary” did little to remedy a fraught situation. “This public posturing on both sides is therefore misguided by both governments.” Domestically, Trudeau has faced growing criticism from opposition parties for his reluctance to speak directly with the Chinese president, Xi Jinping. Said Byers: “I think the avoidance of direct leader-to-leader is a good policy. We have diplomats for a reason and our embassy enables us to communicate messages – outside of the public spotlight.”",2019-01-16 06:14:56+01:00
world/2019/feb/22/canada-jagmeet-singh-faces-existential-byelection-on-road-to-challenge-trudeau,article,world,World news,2019-02-22 15:58:25+00:00,Canada: Jagmeet Singh faces existential byelection on road to challenge Trudeau,https://www.theguardian.com/world/2019/feb/22/canada-jagmeet-singh-faces-existential-byelection-on-road-to-challenge-trudeau,"The leader of Canada’s left-of-centre New Democratic party is facing a key byelection on Monday which will decide whether or not he is able to challenge Justin Trudeau in October. Jagmeet Singh, the first non-white leader of a major political party in the country’s history, must win the byelection in Burnaby, a city east of Vancouver, in order to get a seat in parliament and be in position to go up against the PM in this year’s general election. While parties often decline to challenge a leader seeking a seat, both the Liberals, Conservatives and the newly formed People’s party are running candidates in Burnaby South. Singh, the former human rights lawyer-turned-politician surprised his party – and the country – when he wrapped up the leadership race with a decisive first ballot win more than a year and a half ago. His quick rise in federal politics has excited voters across the country. “His leadership can be seen as refreshing. People saw him as this very telegenic, easy-to-like guy, who might be able to compete on the celebrity level with Trudeau,” said Lori Turnbull, the director of Dalhousie University’s school of public administration. But since his leadership win in late 2017, he and his progressive party have fallen into disarray. Sitting parliamentarians have resigned; others have indicated they won’t seek re-election. To make matters worse, the plurality of the seats currently held by the NDP are in Quebec, a province where support for the party has plummeted. “He’s going to get wiped out completely in Quebec,” said Nelson Wiseman, a political science professor at the University of Toronto. The current situation is a far cry from the the party’s “orange wave” success in Quebec under former leader Jack Layton. Even as recently as the summer of 2015, multiple polls had the NDP on the verge of winning their first federal election, only to have their dreams dashed by a late surge by Justin Trudeau’s Liberal party. The NDP currently sit a distant third in national polling. With party veterans fleeing, haemorrhaging finances and weak poll numbers, the rookie leader has the daunting task of salvaging and reconstituting the left-of-centre party, ensuring a battle-ready machine for the country’s election later this year. Some of Singh’s challenges can be attributed to his absence in the House of Commons: despite leading the party, he remains seatless. “Because he doesn’t have a seat, he hasn’t really been given a lot of opportunity to indicate what his message is. He’s not in the house with the rest of the [leaders],” said Turnbull. While touring across the country seems like a good idea, she said, Singh can’t be seen trading barbs with other party leaders. Some feel that Singh’s status as the first non-white leader of a major political party has also prompted unfair criticism of his tenure. While newly minted political leaders in Canada get “put through the wringer”, the treatment of Singh has been disgraceful, said Rick Smith, executive director at the progressive Broadbent Institute and a former NDP staffer. “What doesn’t get nearly the amount of focus that it deserves in the media is the daily a torrent of racist nonsense that gets thrown his way,” he said. At the same time, the problems gripping the party are not Singh’s alone. “The NDP has always had a bit of an existential crisis, maybe even more than other parties. At some point, a party has to decide, is it their goal to win an election?” said Turnbull. “Or is to set out principles and be true to those principles, even if sometimes they’re not politically popular?” The broader weakness of the party also raises questions about the future ambitions of the party in Canada’s left-of-centre politics. Long seen as the “conscience” of the country’s political system, the party increasingly has to compete against the Liberals to its right – and the Green party to its left. But Smith isn’t convinced the party’s prospects are dire. “Over my adult life, the NDP has grown much stronger everywhere across the country,” he said, calling it a “much more sophisticated political machine” than it was even a decade ago. He sees Singh as a deeply capable, charismatic leader – pointing to his ability to drive high turnout in key races – and his ability to flip regions, like the Toronto suburbs, to the NDP. For Smith, there is little to fret over in the upcoming byelection: “He was always going to win in Burnaby … This is a guy who is very warm, likeable, engaging and knowledgeable.” Monday’s test will be politically existential for Singh: as he canvasses neighbourhoods, party members have said Singh’s continued leadership is unlikely if he fails to win.",2019-02-22 16:58:25+01:00
