id,type,sectionId,sectionName,webPublicationDate,webTitle,webUrl,body,dateTimeLocal
world/2018/jan/09/justin-trudeau-joshua-boyle-hostage-meeting-arrest,article,world,World news,2018-01-10 01:10:55+00:00,Trudeau suggests meeting with Joshua Boyle before arrest raised no red flags,https://www.theguardian.com/world/2018/jan/09/justin-trudeau-joshua-boyle-hostage-meeting-arrest,"Justin Trudeau has suggested that security and intelligence officials in Canada raised no red flags over his decision to meet Joshua Boyle and his family in December, less than two weeks before the former hostage was arrested on more than a dozen charges including sexual assault, forcible confinement and uttering a death threat.  During an interview with a Halifax radio station on Tuesday, the Canadian prime minister was asked whether he regretted the meeting. Trudeau pointed to the work his government had done to support Canadians caught in difficult situations abroad.    Related: Former hostage Joshua Boyle remains in jail after Ottawa court appearance    His office is often directly engaged in these cases, said Trudeau, resulting in him meeting with a number of people who have been freed after overseas ordeals. “So these kinds of things are something that I do, I always try to defer to meeting with more people rather than fewer people, in particular people for whom we’ve been working hard over the past years,” he said. “I think that’s something that’s important to do.”     Today was a wonderful experience for my family, and Ma&#39;idah Grace Makepeace seemed truly enamoured. Incidentally, not our first meeting with @JustinTrudeau, that was &#39;06 in Toronto over other common interests, haha. pic.twitter.com/Aj2eVGJoux&mdash; The Boyle Family (@BoylesVsWorld) December 19, 2017    The interviewer then asked whether the meeting had perhaps been the result of a lack of judgment or bad advice from his staff. Trudeau replied: “We make sure that we follow all the advice that our security professionals and intelligence agencies give us and that’s exactly what we did in this case.” Boyle was rescued in late 2017 in Pakistan, along with his American wife, Caitlan Coleman, and their three young children, all of whom were born during the couple’s five years in captivity. The couple – who were more than six months pregnant at the time – were backpacking through Afghanistan when they were abducted.  Last week, after news broke of Boyle’s arrest on 15 charges, including eight counts of assault and two counts of sexual assault, questions began swirling over the family’s December meeting with Trudeau at the prime minister’s office on Parliament Hill. Some columnists raised red flags over Boyle’s previous, brief marriage to Zaynab Khadr, whose father was a senior al-Qaida financier with links to Osama bin Laden, arguing the link should have been enough to discourage Trudeau from granting the meeting.      Justin Trudeau: ‘We make sure that we follow all the advice that our security professionals and intelligence agencies give us and that’s exactly what we did.’ Photograph: Adrian Wyld/AP    Others cited the many unanswered questions about why Boyle and Coleman were travelling in Afghanistan in the first place. “In various expositions, Boyle has claimed they unwittingly crossed into Afghanistan from Pakistan while backpacking through Central Asia, that they’d gone to Afghanistan as ‘pilgrims’ on a humanitarian mission to help civilians living in Taliban-control regions, and also that he’d hoped to get himself ‘embedded’ as a journalist with the Taliban. Take your pick,” noted one Toronto Star columnist.   Related: Canadian American family on surviving Taliban captivity: 'We tried to make it fun'    Opposition politicians also took aim. “How can a politician be taken like this? Even in the opposition we had information that was setting off alarms,” Conservative MP Pierre Paul-Hus wrote on social media.  Police have not disclosed whether Boyle was under investigation at the time of his meeting with Trudeau. News of the encounter emerged after the family published photos on social media showing Trudeau holding the couple’s youngest child in mid-December. A government official told the Guardian that the meeting had taken place at the request of the Boyle family.  Boyle remains in detention awaiting a bail hearing. The incidents are alleged to have taken place following the family’s return to Canada. A publication ban prevents the alleged victims from being identified. None of the allegations have been proven in court. Speaking to the Guardian last week, his lawyer stressed that Boyle is presumed innocent and has no criminal record.",2018-01-10 02:10:55+01:00
world/2018/jan/13/us-canada-trump-trudeau-trade,article,world,World news,2018-01-13 11:30:00+00:00,Trump-Trudeau love-in threatened as Canada attacks US over trade,https://www.theguardian.com/world/2018/jan/13/us-canada-trump-trudeau-trade,"The charm offensive was already under way before Donald Trump moved into the White House. By inauguration, Justin Trudeau’s top advisers had fostered close contacts with Trump’s inner circle, setting the stage for a Washington visit peppered with smiles, handshakes and photo ops. But this week relations between Canada and the US seemingly struck a different note, as news broke that Ottawa had launched an all-out trade war against Washington. In a wide-ranging complaint, filed in December and made public on Wednesday by the World Trade Organization, Canada has taken aim at Washington’s use of anti-dumping and anti-subsidy duties. The complaint listed nearly 200 cases spanning two decades, alleging wrongdoing not only against Canada but dozens of other countries, such as Brazil, China and India. Canadian officials portrayed the filing as a clear message that Canada was standing up for its industries and workers. “When people see that you’re firm, you get respect,” François-Philippe Champagne, Canada’s international trade minister told reporters.   Related: Canada v Mexico: Trump seeks to divide and conquer in Nafta negotiations    Looming over Ottawa message are the high stakes renegotiations of the North American Free Trade Agreement. Amid Trump’s repeated threats to pull out of the decades-old pact, the Canadian government has been scrambling to hammer out a reasonable update that would safeguard the roughly 2.5m Canadian jobs and 75% of Canadian exports tied to the pact. Some pointed to the tough talk as a plan B by the Trudeau government. “By dropping the gloves in such a public way, Canada is acknowledging that playing nice with Mr Trump on trades has failed miserably,” noted a columnist for the Globe and Mail. Whether the approach had yielded results was a matter of debate: while much of Trump’s rhetoric has been aimed at Mexico, his initial actions were aimed at Canada. A series of aggressive trade actions saw steep tariffs and duties levied on Canadian softwood lumber, Bombardier CSeries aircraft and, just this week, newsprint. Trump paired these with a broad attack. “We can’t let Canada or anybody else take advantage and do what they did to our workers and to our farmers,” he told reporters in April. The WTO complaint suggests the Trudeau government has evolved in its approach , said John Weekes, Canada’s former WTO ambassador and chief Nafta negotiator. “This is really about sending a signal to the Americans that we’re prepared to be tough.” The timing of this signal suggests the Canadian government sees the sixth round of Nafta negotiations – slated to begin later this month in Montreal – as a vital opportunity to determine whether the US is willing to find common ground on the thorny issues such as the rules governing the auto industry and trade dispute mechanisms, said Weekes. On Wednesday US trade representative Robert Lighthizer made clear his belief that Canada’s WTO complaint would simply exacerbate trade tensions. “Canada’s new request for consultations at the WTO is a broad and ill-advised attack on the US trade remedies system,” Lighthizer said in a statement. “Canada’s claims are unfounded and could only lower US confidence that Canada is committed to mutually beneficial trade.” But in the transcript of an interview with the Wall Street Journal published Thursday, Trump struck a more upbeat tone, saying that there was a chance of making a reasonable deal, and hinting his administration would be open to extending the timeline of Nafta talks. This week saw headlines suggesting that Canada is readying for Trump’s imminent withdrawal from Nafta, but Canadian officials have long been prepared for the possibility, said Colin Robertson of the Canadian Global Affairs Institute. Canada has shown no sign of slowing its outreach plan that has sent representatives from the Canadian government and businesses on hundreds of trips across the US to talk up trade with Canada.  Relations between Chrystia Freeland, Canada’s foreign minister and Rex Tillerson remain close, and other channels of communication remain open. “I think that conversations are still taking place between the prime minister and Mr Trump,” he said.",2018-01-13 12:30:00+01:00
business/2018/jan/23/justin-trudeau-tells-davos-tackle-inequality-or-risk-failure,article,business,Business,2018-01-23 18:44:05+00:00,Justin Trudeau tells Davos: tackle inequality or risk failure,https://www.theguardian.com/business/2018/jan/23/justin-trudeau-tells-davos-tackle-inequality-or-risk-failure,"Canada’s prime minister, Justin Trudeau, has challenged leaders of the world’s biggest corporations to hire more women and to tackle sexual harassment as he warned that a business-as-usual approach to tackling inequality would lead to failure for everyone. 
In a keynote speech to the World Economic Forum in Davos, Trudeau said hiring, promoting and retaining more women was the key to narrowing the “staggering” gap between rich and poor. 
Business leaders at the annual WEF meeting in Switzerland have enjoyed an increase in wealth in the past year as a result of rising stock markets but the Canadian premier asked whether they wanted “to live in gated enclaves while those around them struggle”. 
 
  Related: Cate Blanchett urges Davos to give refugees more compassion  
 
He said: “Too many corporations have single-mindedly put the pursuit of profit before the wellbeing of workers. All the while, companies avoid taxes and boast record profits with one hand while slashing benefits with the other.” 
Trudeau said that employing more women was the smart thing to do, adding that it would lead to a greater diversity of ideas, more innovation and fewer disputes. 
He said there needed to be a critical discussion about the the rights, equality and power dynamics of gender. “Sexual harassment in business and government is a systemic problem and it is unacceptable,” Trudeau said, giving his support to the #MeToo campaign that started after the revelations about the Hollywood mogul Harvey Weinstein. “As leaders, we must recognise and act to truly show that time is up.” 
 
  
 
  Sign up to the daily Business Today email or follow Guardian Business on Twitter at @BusinessDesk
  
 
Trudeau used his speech to announce that the 10 remaining members of the Trans Pacific Partnership would go ahead with a free trade agreement despite Donald Trump’s decision to pull the US out of the deal. 
The US president is due to speak in Davos on Friday but, before his arrival, the heads of some of the world’s leading financial institutions were warning that the stock market boom since his election victory could be threatened by systemic IT failure, political crisis or a failure to remember the lessons of the recent past. 
Concerns that the recent rise in share prices that has taken markets around the world to record highs might be too good to last dominated the first full day of the Davos event. 
Anne Richards, the chief executive of the UK’s M&amp;G Investments, said a collapse of IT systems that put markets out of action for several days could be the trigger for a crash. “We all have businesses which are absolutely reliant on a very small number of people who provide the [IT] pipes that effectively we all put our business though,” she said. 
Jes Staley, the chief executive of Barclays, said the mood reminded him of how Davos had been in the year before the biggest financial meltdown in recent history, noting that it was “a little bit like 2006 when we were all talking whether we’ve solved the riddle of economic crises”. 
David Rubenstein, the co-founder of the Carlyle Group, a US private equity and asset management company, said: “Generally, when people are happy and confident, something wrong happens.” 
The Indian prime minister, Narendra Modi, warned that globalisation was under attack from the “forces of protectionism ... who want to reverse its flow”. He cited climate change and terrorism as major threats to the global economy. 
 
  Related: Davos 2018: Justin Trudeau blasts gender inequality; Modi warns against protectionism; Blanchett on refugees - as it happened  
 
“Everyone talks about reducing climate emissions, but there are very few countries who back their words with their resources to help developing countries to adopt appropriate technology,” Modi told delegates. 
The rise of technology giants also came under scrutiny. David Autor, the Ford professor of economics at MIT, pointed out that companies that appear all-powerful can actually fade pretty fast, either because regulators act or markets change. 
Walmart was considered indomitable 15 years ago, now it faced enormous competition from Amazon, Autor said, adding: “I would guess that Facebook will be almost non-existent 20 years from now.”",2018-01-23 19:44:05+01:00
world/2018/feb/07/justin-trudeau-tells-woman-to-say-peoplekind-not-mankind,article,world,World news,2018-02-07 03:42:33+00:00,Justin Trudeau tells woman to say 'peoplekind' not 'mankind',https://www.theguardian.com/world/2018/feb/07/justin-trudeau-tells-woman-to-say-peoplekind-not-mankind,"The Canadian prime minister, Justin Trudeau, has come under fire for “mansplaining” and being too politically correct after he interrupted a woman and lightheartedly corrected her for saying “mankind” not “peoplekind” at a town hall event in Canada on Friday.  His correction came at the conclusion of a longwinded question from anaudience member that, over the course of three minutes, included a discussion of her church and the special power of “maternal love”.   Related: Justin Trudeau tells Davos: tackle inequality or risk failure    The questioner ended by asking Trudeau to look at laws surrounding the charitable status of religious organisations, saying , “maternal love is the love that’s going to change the future of mankind”. To which Trudeau said: “We like to say ‘peoplekind’, not necessarily ‘mankind’, because it’s more inclusive.” His comments have drawn ridicule from conservative media who have seized on them to accuse him of “virtue signalling”, being too politically correct and for “mansplaining”, a term coined by a feminist author and popularised by feminist discourse.  The Australian conservative commentator Rita Panahi said Trudeau’s use of “peoplekind” was an attempt to “appease those desperate to find offence where none exists”. Fox News dedicated a segment to the controversy, enlisting the help of Jordan Peterson, a Canadian professor who has found fame after arguing against “political correctness”, especially the use of preferred pronouns.  However, some have suggested that the rightwing furore surrounding his comments has been manufactured in bad faith.  Daniel Dale, Washington correspondent for the Toronto Star, said that the “pile-on” was misleading as Trudeau was “lightly ribbing a woman who was rambling about the power of women” and accused it of omitting important context.     The US-right-wing pile-on re Trudeau&#39;s &quot;peoplekind&quot; is pretty misleading. He was lightly ribbing a woman who was rambling about the power of women, &quot;God the Mother,&quot; and how the world needs womanly love. Fox excluded her response to him: &quot;There you go, exactly. Yes. Thank you.&quot; pic.twitter.com/Wl4QIumWrA&mdash; Daniel Dale (@ddale8) February 6, 2018    The woman did indeed thank the prime minister for his correction and Trudeau allowed her a considerable time to speak.  The prime minister has made comments in the past that have come under fire for their seeming facetiousness.",2018-02-07 04:42:33+01:00
world/2018/feb/07/justin-trudeau-apologises-joke-personkind-viral,article,world,World news,2018-02-07 18:19:48+00:00,Justin Trudeau apologises for 'dumb joke' after 'peoplekind' quote goes viral,https://www.theguardian.com/world/2018/feb/07/justin-trudeau-apologises-joke-personkind-viral,"The Canadian prime minister, Justin Trudeau, has apologised for making a “dumb joke” after he interrupted a woman and lightheartedly corrected her for saying “mankind”, not “peoplekind”.  His comments last week drew ridicule from critics who variously accused Trudeau of mansplaining and excessive political correctness.  “You all know that I don’t necessarily have the best of track records on jokes. I made a dumb joke a few days ago that seems to have gone a little viral,” he said on Wednesday.   Related: Justin Trudeau tells woman to say 'peoplekind' not 'mankind'    “It played well in the room and in context. Out of context it doesn’t play so well and it’s a little reminder to me that I shouldn’t be making jokes even when I think they’re funny.” His original comment came during a town hall meeting in Edmonton on Friday, at the conclusion of a longwinded question from an audience member. The questioner ended by asking Trudeau to look at laws surrounding the charitable status of religious organisations, saying: “Maternal love is the love that’s going to change the future of mankind”.  To which Trudeau replied “We like to say ‘peoplekind’, not necessarily ‘mankind’, because it’s more inclusive.” His comments drew ridicule from members of the conservative media who have seized on them to accuse him of “virtue signalling”. However, some have suggested that the furore was manufactured in bad faith.  Daniel Dale, Washington correspondent for the Toronto Star, said that the “pile-on” was misleading as Trudeau was “lightly ribbing a woman who was rambling about the power of women” and accused it of omitting important context.     The US-right-wing pile-on re Trudeau&#39;s &quot;peoplekind&quot; is pretty misleading. He was lightly ribbing a woman who was rambling about the power of women, &quot;God the Mother,&quot; and how the world needs womanly love. Fox excluded her response to him: &quot;There you go, exactly. Yes. Thank you.&quot; pic.twitter.com/Wl4QIumWrA&mdash; Daniel Dale (@ddale8) February 6, 2018    Political opponents and commentators have in the past complained that Trudeau lacks the gravitas needed to be a national leader.  In his first public remarks after a devastating wildfire ripped through an Albertan oil-producing region in 2016, he began with a quip about the Star Wars movie franchise.  In October 2014, when he was still in opposition, Trudeau criticised the then Conservative government for joining the coalition against Islamic State. He said humanitarian aid was better than “trying to whip out our [fighter jets] and show them how big they are”.",2018-02-07 19:19:48+01:00
environment/true-north/2018/feb/09/trudeau-government-welcomed-oil-lobby-help-for-us-pipeline-push-documents,article,environment,Environment,2018-02-09 07:52:47+00:00,Revealed: Trudeau government welcomed oil lobby help for US pipeline push,https://www.theguardian.com/environment/true-north/2018/feb/09/trudeau-government-welcomed-oil-lobby-help-for-us-pipeline-push-documents,"The Trudeau government treated Donald Trump’s election as “positive news” for Canada’s energy industry and welcomed the help of Canada’s main corporate oil group in lobbying the US administration, documents show.  Meetings conducted by senior government officials with TransCanada and the Canadian Association of Petroleum Producers (CAPP) reveal an one-sided approach more reminiscent of former Prime Minister Stephen Harper’s secret oil advocacy than Justin Trudeau’s green electoral promises. The Liberal government has strongly backed the export of Alberta tar sands via the Keystone XL pipeline, which was initially rejected by the Obama administration on climate grounds but approved by Trump in March 2017. The documents, obtained through access-to-information, show the Parliamentary Secretary to Canada’s Foreign Affairs Minister met around the same time with TransCanada’s CEO Russ Girling and CAPP to discuss the continued promotion of the pipeline and oil exports.  The briefing note states that the oil lobby group “specifically will be interested to hear the outcomes of the recent visits by Prime Minister Trudeau and Minister Freeland to the United States, as well as volunteering their services (or those of members) in the Government’s U.S. engagement efforts.”  The Parliamentary Secretary was advised to respond by saying “we welcome your engagement offer and would like to stay in touch.” The Guardian asked CAPP what kind of services they had volunteered but the lobby group declined to answer. CAPP shares many members with its US-counterpart, the American Petroleum Institute, whose lobbying of the Trump administration has resulted in cuts to environmental regulations and the speed-up of permits for oil and gas drilling.  The briefing documents appear to present Trump’s approach to energy policy as an improvement over that of Obama’s. “The swearing in of a new administration in the United States that recognizes the strategic importance of Canada’s role in North American energy security is, so far, positive news for the Canadian energy sector with regard to a potential increase in energy trade,” a document from May 2017 reads.  “The main guiding principle of President Trump’s energy policy is U.S. energy security independence through increasing domestic production of all energy forms (oil, gas coal and nuclear).” The words “climate change” do not appear anywhere in the government documents. Stephen Harper’s Conservative government had previously worked closely with the oil industry lobby to undermine clean policy measures and encourage massive oil exports in the U.S. and Europe. In contrast, Prime Minister Trudeau promised in his election platform to achieve an “ambitious North American clean energy and environment agreement” that would make the continent the “world’s most efficient and responsible energy producer.” “Canadians who voted for Trudeau probably didn’t expect him to use Trump’s election as an opportunity to bypass concerns over environmental protection and Indigenous rights,” said Keith Stewart, a senior energy analyst at Greenpeace who obtained the documents. “The Trudeau government’s abandonment of ambitious climate policy in dealing with Trump and their backroom outreach to oil lobbyists has more in common with the Harper government than the actions of a self-proclaimed climate champion.”   The Ministry of Foreign Affairs did not respond to requests for comment.  Trudeau has unreservedly supported Keystone XL, but the documents acknowledge that it faces opposition along its potential route, as protests and several lawsuits threaten to trip up TransCanada’s construction.  “Major resistance to the KXL project is occurring in South Dakota and Nebraska where farmers, indigenous groups, environmental groups and land owners are taking issue with the project,” one document says. The Obama Administration rejected Keystone XL after a “climate test” found the shipping of 800,00 barrels of tar sands a day would undercut efforts to combat climate change. Last week the British Columbia government moved to block the proposed west-ward Kinder Morgan pipeline expansion by introducing new oil-spill regulations, to which Alberta’s premier responded by announcing a boycott of B.C.’s wine. Yesterday the Canadian government tabled legislation to overhaul environmental reviews of major resource projects. It has been praised for creating a new energy regulator and more opportunities for public participation, but concerns have been raised about restrictive assessments and a lack of safeguards against industry interests continuing to trump other considerations.  This investigation was supported by the Corporate Mapping Project ",2018-02-09 08:52:47+01:00
