id,type,sectionId,sectionName,webPublicationDate,webTitle,webUrl,body,dateTimeLocal
world/2019/feb/26/canada-jagmeet-singh-gets-chance-to-take-on-trudeau-after-byelection-win,article,world,World news,2019-02-26 07:15:24+00:00,Canada: Jagmeet Singh gets chance to take on Trudeau after byelection win,https://www.theguardian.com/world/2019/feb/26/canada-jagmeet-singh-gets-chance-to-take-on-trudeau-after-byelection-win,"Jagmeet Singh, the leader of Canada’s New Democratic party, has won a critical byelection and a seat in parliament, ensuring he will lead the left-of-centre party in the country’s October federal election. Singh, the first non-white leader of a major party in Canada, was under immense pressure to win the highly anticipated race in Burnaby, a city east of Vancouver. “Friends, we made history today,” he told supporters. “When I was growing up, I could have never imagined someone like me running to be prime minister.” Calling the victory “incredible”, Singh pledged to fight for Canada’s middle class and took direct aim at growing fears of xenophobia in the country. The rookie leader, who has been seen as an energising force in Canadian politics, will have a place in the House of Commons, allowing him to spar with other leaders and the prime minister, Justin Trudeau, ahead of the election.   Related: Canada: Jagmeet Singh faces existential byelection on road to challenge Trudeau    The victory was critical for the party leader: amid sagging poll numbers nationally and fundraising difficulties for the party, senior members had cast doubts over his future leadership had he not secured the win. “Jagmeet Singh has always been underestimated,” his brother Gurratan Singh tweeted as results were reported. “And he always proves them wrong.” Typically, leaders of federal parties in Canada decline to run competitive candidates when another leader is seeking a seat. The Liberal party, as well as the Conservatives and the People’s party, all ran candidates in the Burnaby South electoral district. The Green party chose not to run a candidate. The closely watched byelection was not without controversy. In January, Liberal candidate Karen Wang was forced to step aside after making racially charged remarks about Singh.  “If we can increase the voting rate, as the only Chinese candidate in this riding, if I can garner 16,000 votes I will easily win the by-election, control the election race and make history!” she wrote on WeChat. “My opponent in this by-election is the NDP candidate Singh of Indian descent!”   Related: Justin Trudeau’s image of transparency threatened by scandal    The text was widely condemned by both the NDP and the Liberals. Wang stepped down at the request of Trudeau. While the win is a relief for Singh, the electoral district of Burnaby South is widely viewed as an NDP stronghold. In two other byelections across the country, the NDP lost Outremont, handing over the Quebec seat once held by its former leader to the Liberal party candidate, Rachel Bendayan. In the Ontario seat of York-Simcoe, won by Conservative Scot Davidson, independent candidate John “The Engineer” Turmel, who holds the world record for the most contested elections, kept his streak going, notching his 96th loss –with less than 1% of the vote.",2019-02-26 08:15:24+01:00
us-news/2019/feb/27/us-briefing-michael-cohen-medicare-for-all-and-trudeau-scandal,article,us-news,US news,2019-02-27 11:12:50+00:00,"US briefing: Michael Cohen, Medicare for All and Trudeau scandal",https://www.theguardian.com/us-news/2019/feb/27/us-briefing-michael-cohen-medicare-for-all-and-trudeau-scandal,"Good morning, I’m Tim Walker with today’s essential stories. Cohen to call Trump a ‘racist’ and ‘conman’ at public hearing Michael Cohen is set to describe his former boss Donald Trump as a “racist”, a “cheat” and a “conman” in prepared remarks at the opening of his public testimony to the House oversight committee on Wednesday. The president’s former lawyer also intends to make the bombshell claim that he witnessed Trump speaking to the adviser Roger Stone about Stone’s contacts with WikiLeaks during the 2016 presidential campaign – and that Stone told Trump of WikiLeaks’ plan to publish emails stolen from the Democratic National Committee and Hillary Clinton’s campaign.  Key claims. Josephine Tovey breaks down the most explosive extracts from Cohen’s prepared testimony, including details of the Moscow Trump Tower project, his payoff to the adult film star Stormy Daniels and Trump’s private racism.  House Democrats unveil Medicare for All bill     Senator Bernie Sanders speaks with other Democrats during their previous attempt to introduce a ‘Medicare for All Act’ in 2017. Photograph: Yuri Gripas/Reuters    House Democrats are making an ambitious new attempt to overhaul US healthcare by introducing the Medicare for All Act of 2019 on Wednesday. Once embraced only by the party’s left wing and promoted by Senator Bernie Sanders during his 2016 presidential run, the idea of Medicare for All is now close to being Democratic orthodoxy. The plan will, for the first time, be subject to congressional hearings, despite having no chance of passing the GOP-controlled Senate.  Emergency blocked. The House has passed a resolution to revoke Trump’s national emergency declaration, to block the president from funding a border wall without congressional approval. Several Senate Republicans have indicated they may vote for the resolution, which would mark a direct challenge to the president’s power from his own party.  Pioneering ex-minister to testify over Canada scandal     Jody Wilson-Raybould with Justin Trudeau during her swearing-in ceremony in 2015. Photograph: Adrian Wyld/AFP/Getty Images    Jody Wilson-Raybould, who was Canada’s first indigenous attorney general, will testify to the Canadian parliament’s justice committee on Wednesday, addressing in public for the first time allegations that she was pressured to drop prosecutions targeting a major engineering firm by aides from the office of the prime minister, Justin Trudeau. The pioneering former minister of justice was demoted to the role of veterans affairs minister last year and resigned from the cabinet earlier this month.  Election year. The growing scandal comes as Trudeau prepares for a federal election in October, where he will face Jagmeet Singh of the New Democratic party, whose byelection win this week has cemented his position as the first non-white leader of a major party in Canada.  Plastic waste found even in the world’s deepest waters     A green turtle eats a plastic bag resembling a jellyfish. Photograph: Alamy    Plastic waste is contaminating the Mariana Trench and at least five more of the deepest spots on Earth, scientists have found, concluding in a study that “it is highly likely there are no marine ecosystems left that are not impacted by plastic pollution”. The researchers found evidence of microplastic ingestion by organisms even at depths of more than 6,000 metres, suggesting the problem of plastic waste is far more profound than was previously known.  Reproductive problems. In shallower waters and on land, plastics are being blamed for reproductive problems among wildlife. Another report found, for example, an orca pod facing high levels of pollutants that has failed to produce a single calf in 25 years.  Crib sheet  Donald Trump and Kim Jong-un have arrived in Vietnam for their Hanoi summit, set to begin on Wednesday. Julian Borger explains the stakes of the meeting, which you can follow via the Guardian’s live blog. Pakistan says it has shot down two Indian jets as hostilities between the two nuclear-armed neighbours escalated on either side of their disputed border in Kashmir. India has yet to confirm the claims. The FBI is struggling to attract new recruits, according to a report by the Wall Street Journal, which said the number of applicants for special agent positions had plummeted from 68,500 in 2009 to just 11,500 last year. Eight rescuers including firefighters have taken part in the rescue of an overweight rat from a sewer grate in Bensheim, Germany, where the fat rodent had got stuck after piling on the ounces over the winter.  Must-reads     A dog awaits surgery in the operating theatre at Battersea Dogs &amp; Cats home in London. Photograph: Jill Mead/The Guardian    The surgeons keeping pugs and bulldogs alive They may look cute on Instagram, but flat-faced dogs are prone to serious breathing problems, and more and more are undergoing surgery to save their lives. Simon Usborne steps into the operating theatre to see the gory results of an unchecked pet trend. The Grand Canyon ranger who’s older than the park Rose Torphy is 103 years old: three years older than the Grand Canyon national park, which is celebrating its centenary in 2019 and where she was recently sworn in as a junior park ranger. The canyon is “the most marvelous thing”, she tells Eric Lutz. Behind a landmark documentary about Apollo 11 Half a century after humans first went to the moon, the film-maker Todd Douglas Miller has worked with Nasa to restore remarkable unseen footage from the Apollo 11 mission. The result, says Adrian Horton, is this year’s first must-see documentary. The artist collecting America’s neighbourhood murals Camilo Jose Vergara, the Chilean-born photographer and MacArthur Fellow, has spent four decades travelling the US, photographing the work of anonymous local muralists and street artists in poor, segregated communities. Opinion The world is waking up to the unchecked power of Big Tech. But to truly enfranchise those excluded from the digital economy, says Evgeny Morozov, the left must think more radically than the neoliberals and technocrats who currently represent them.  How could digital technologies help redesign core political institutions, including representative democracy and its bureaucratic apparatus, and make them more decentralized and participatory?  Sport It’s 100 days until the Women’s World Cup kicks off in France on 7 June. As Team USA prepare to defend their title, Louise Taylor tells you everything you need to know about the tournament. With MLS returning this weekend, the Guardian’s soccer writers make their predictions for the season, which ought to be a big one for former European stars Wayne Rooney and Zlatan Ibrahimović. Sign up The US morning briefing is delivered to thousands of inboxes every weekday. If you’re not already signed up, subscribe now.     Sign up for the US morning briefing ",2019-02-27 12:12:50+01:00
world/2019/feb/27/canada-trudeau-snc-lavalin-jody-wilson-raybould,article,world,World news,2019-02-28 01:42:30+00:00,Justin Trudeau refuses to resign over claims officials interfered in bribery prosecution,https://www.theguardian.com/world/2019/feb/27/canada-trudeau-snc-lavalin-jody-wilson-raybould,"Canadian prime minister Justin Trudeau has rejected calls to resign over a scandal that is engulfing his administration, saying he and his staff always acted properly and that Canadians will get to have their say on the matter at the federal election in October. His comments came after Canada’s former minister of justice and attorney general Jody Wilson-Raybould described a consistent, sustained and inappropriate effort by senior officials close to the prime minister who were attempting to dissuade her from prosecuting a Canadian engineering company accused of bribery. In searing testimony to the justice committee on Wednesday, Wilson-Raybould said the pressure on her included “veiled threats” if she did not acquiesce. “I experienced a consistent and sustained effort by many people within the government to seek to politically interfere in the exercise of prosecutorial discretion in my role as the attorney general of Canada in an inappropriate effort,” she said in her opening statement. Wilson-Raybould’s appearance before the committee marked her first public comments on the scandal, which has become the biggest crisis of Trudeau’s administration.   Related: The pioneering ex-minister at the centre of a Canadian scandal    In early February, the Globe and Mail reported that aides close to the prime minister had lobbied Wilson-Raybould to abandon plans to prosecute Quebec-based engineering company SNC Lavalin over accusations of fraud and bribery. Instead, they requested she pursue a “deferred prosecution agreement”, which allowed the company to pay a fine. Wilson-Raybould said she was “barraged” and subjected to “hounding” by members of the government. According to contemporaneous notes taken after each interaction, Wilson-Raybould recalled 10 phone calls and 10 meetings regarding the case. Wilson-Raybould also detailed a meeting with Trudeau, in which the prime minister said that – as a member of parliament from Quebec – he was concerned by the issue of SNC Lavalin jobs in the province, and asked her to “help out” with the case. “Are you politically interfering with my role as attorney general? I would strongly advise against it,” Wilson-Raybould recalled telling the prime minister. “No, no, no, we just need to find a solution,” she said, recalling the prime minister’s answer. On Wednesday night, Trudeau said it had been a “difficult few weeks” because of internal disagreements in his party, but rejected opposition calls to resign. He said he completely disagreed with Wilson-Raybould, saying that the decision to avoid prosecuting SNC-Lavalin was hers and hers alone. Wilson-Raybould also described a conversation with the government’s top civil servant, Michael Wernick, who advised her the prime minister wanted to “find a way to get it done, one way or another. She characterized the discussions as “treading on dangerous ground”. Last week, Wernick told the same committee that no improper pressure was applied to Wilson-Raybould. Trudeau’s government has been on the defensive since the Globe and Mail newspaper reported on 7 February that Trudeau or his staff pressured her to try to avoid a criminal prosecution of SNC-Lavalin over allegations of corruption involving government contracts in Libya. Wilson-Raybould refused to abandon the prosecution, and four months later, she was abruptly demoted to the position of veteran affairs minister – a move which she saw as a direct consequence. “I can’t help but think this ha[d] something to do with a decision I would not take,” she told the committee. Following her demotion, she had “thoughts of the Saturday Night Massacre,” Wilson-Raybould testified, in a reference to Richard Nixon’s purge of US justice department officials during the Watergate scandal. Under growing pressure, Trudeau denied that his office had “directed” Wilson-Raybould, and said her presence in his cabinet was proof of their amicable relationship. She resigned hours later and retained the former supreme court justice Thomas Cromwell as her counsel.   Related: Justin Trudeau’s image of transparency threatened by scandal    Opinion polls show the allegations are starting to hurt the Liberals ahead of what looks set to be a tightly contested federal election against the official opposition Conservative party in October. Opposition lawmakers accuse Trudeau of trying to cover up an attempt by officials to help SNC-Lavalin, which could be banned from bidding for federal contracts for a decade if found guilty. “Justin Trudeau can no longer hide the fact that he was at the center of an attempt to interfere in a criminal prosecution. He must come clean with Canadians,” Conservative leader Andrew Scheer said on Wednesday before the testimony. Scheer called on Trudeau to stand down and demanded a police inquiry. “He can no longer, with a clear conscience, continue to lead this nation,” he said. The scandal has already cost Trudeau his closest adviser: Gerald Butts resigned earlier this month, but denied he had or others had improperly pressured Wilson-Raybould. “What I hear today should make Canadians upset,” Murray Rankin, a member of the New Democratic party, told Wilson-Raybould during the committee hearing. Wilson-Raybould was granted a partial waiver of solicitor-client privilege in order to testify on Wednesday, but remains unable to speak about the content of her communications with Trudeau. Wilson-Raybould, a Kwakwaka’wakw lawyer from British Columbia, was Canada’s first indigenous attorney general, and her inclusion in the cabinet was initially seen as proof of Trudeau’s attempt to reset its relationship with indigenous peoples. “I was taught to always hold true to your core values, principles and to act with integrity,” said Wilson-Raybould at the conclusion of her statement. “I come from a long line of matriarchs and I am a truth-teller in accordance with the laws and traditions of our big house. This is who I am and who I always will be.”",2019-02-28 02:42:30+01:00
world/2019/feb/28/justin-trudeau-canada-jody-wilson-raybould,article,world,World news,2019-02-28 18:26:16+00:00,Trudeau denies wrongdoing and says ex-minister could be ousted from party,https://www.theguardian.com/world/2019/feb/28/justin-trudeau-canada-jody-wilson-raybould,"Canada’s former attorney general, whose testimony against the prime minister, Justin Trudeau, and his aides has placed his administration firmly on the defensive, could find herself ejected from her party after refusing to confirm she has confidence in his leadership, it emerged on Thursday. 
 
  Related: Justin Trudeau refuses to resign over claims officials interfered in bribery prosecution  
 
Trudeau acknowledged that his former attorney general, Jody Wilson-Raybould, could be removed from the Liberal party, telling reporters on Thursday that he would have to review fully her recent testimony on the deepening scandal before making a decision. 
“My team and I have always acted in a professional manner,” Trudeau told reporters on Thursday morning, rejecting suggestions he or his staff overstepped in their numerous conversations with Wilson-Raybould about their view that an engineering company facing bribery and fraud charges should not be prosecuted. 
On Wednesday, Wilson-Raybould highlighted the extent to which she alleges the prime minister’s closest aides “hounded” her in order to secure a politically beneficial outcome for the party – and Trudeau himself. 
Wilson-Raybould, the first indigenous minister of justice and attorney general in Canadian history, had described a sustained effort by government officials to influence her judgment. Nearly four months after she said the pressure began, she was removed from her job as the country’s top prosecutor – and instead was named minister of veterans affairs. She has repeatedly said she will run again in the federal election as a Liberal party candidate, a move experts view as difficult given her public spat with the prime minister. 
Her characterization of Trudeau’s conduct – and of his aides’ behaviour – is particularly troubling for the Trudeau administration, given the recent controversy over the detention of the Huawei executive Meng Wanzhou. Trudeau had repeatedly said that Canada’s justice system is immune from political interference amid calls by the Chinese for her release. 
On Thursday, Trudeau reaffirmed his belief that all discussions over the matter were proper. 
“I totally disagree with the former attorney general’s characterization [of discussions] in her testimony,” said Trudeau. He denied Wilson-Raybould was removed as attorney general for her refusal to back down. 
Political rivals jumped on Wilson-Raybould’s testimony. Opposition leader Andrew Scheer of the Conservative party said Trudeau had “lost the moral authority to govern” and called for his resignation. Jagmeet Singh, the leader of the New Democratic party, said the prime minister was not on the side of Canadians but stopped short of calling for his resignation. 
 
  
  
  Jody Wilson-Raybould waits to testify before the House of Commons justice committee on Wednesday. 
  Photograph: Chris Wattie/Reuters 
  
 
The scandal first began 7 February, after the Globe and Mail reported the prime minister’s office had improperly pressured Wilson-Raybould to abandon the prosecution of a large engineering company, SNC Lavalin, for fraud and bribery. 
The Quebec engineering giant SNC Lavalin, which paid C$48m (US$36.5m) in bribes to Muammar Gaddafi’s regime in Libya between 2001 to 2011, is lobbying for a remedy known as a deferred prosecution agreement instead of a trial and criminal prosecution. But federal prosecutors are uninterested in pursuing an agreement – a reality Trudeau’s inner circle had struggled to change. 
Wilson-Raybould’s testimony marked the first instance in which the prime minister was directly implicated in efforts to dissuade her from pursuing prosecution. 
“Are you politically interfering with my role as attorney general? I would strongly advise against it,” Wilson-Raybould recalled telling the prime minister, after he reminded her he was a member of parliament from Quebec – and asked her to “help out” in the case. 
“No, no, no, we just need to find a solution,” she said was the prime minister’s answer. 
On 12 February, Wilson-Raybould resigned. The country’s ethics commissioner is currently investigating the accusations.  
Drawing on text messages and contemporaneous memos, she described 10 meeting and 10 telephone calls over the issue, which began in mid September of 218. Wilson-Raybould also testified about the extent of the pressure she faced, including aides promising a flurry of positive op-eds in Canadian papers to provide her political cover if she backed down. The efforts–and threats to undermine her position evoked “thoughts of the Saturday Night Massacre”, the infamous resignations of high-ranking US justice department officials during the Watergate investigations. 
While the scandal has damaged the prime minister’s image of transparency and openness, damage appears to be minimal in Quebec, where support for SNC Lavalin is strong, given the 3,400 people it employs in the province. 
Wilson-Raybould’s testimony marked the first time she has spoken at length about the pressure on her office. Questions still remain about the content of her discussions with the prime minister, which are protected by solicitor-client privilege.",2019-02-28 19:26:16+01:00
