id,type,sectionId,sectionName,webPublicationDate,webTitle,webUrl,body,dateTimeLocal
world/2019/mar/01/explained-the-case-that-could-bring-down-canadas-justin-trudeau,article,world,World news,2019-03-01 02:19:18+00:00,Explained: the case that could bring down Canada's Justin Trudeau,https://www.theguardian.com/world/2019/mar/01/explained-the-case-that-could-bring-down-canadas-justin-trudeau,"What is going on in Canada? 
Canada’s prime minister, Justin Trudeau, is facing the biggest political scandal of his administration. The affair centres around allegations that his former attorney general, Jody Wilson-Raybould, was improperly pressured by some of his closest advisers to prevent the prosecution of a large Canadian engineering firm over accusations of fraud and bribery. Thus far, the scandal has been politically costly; Gerald Butts, a longtime friend of Trudeau’s, and his closest adviser, resigned two weeks ago. Wilson-Raybould had quit a week earlier, within hours of the prime minister denying she was unhappy. A handful of polls are showing the scandal is politically unpopular for the governing Liberals – which is worrying for them, given there is a federal election in October. 
What is the company accused of? 
SNC-Lavalin, based in Montreal, is accused of paying C$48m worth of bribes in Libya to Muammar Gaddafi’s family, in order to secure lucrative contracts. The bribery is alleged to have occurred between 2001 and 2011. If found guilty, the company would be barred from bidding on federal projects for a decade. SNC-Lavalin employs nearly 50,000 people worldwide, with 3,400 in Quebec.  
 
  Related: Trudeau denies wrongdoing and says ex-minister could be ousted from party  
 
Company executives have been lobbying for a “deferred prosecution agreement”, which in effect allows them to pay a fine in lieu of a criminal prosecution, with no ban on bidding for contracts. But federal prosectors have decided to pursue a trial. 
This is where the scandal is centred: the prime minister and his aides, along with the finance minister, have been accused of pressing Wilson-Raybould to intervene and asking prosecutors to accept a deferred prosecution agreement. Wilson-Raybould declined to override the judgment of her top legal team. 
What does the former attorney general say? 
In searing testimony in front of parliament’s justice committee, Wilson-Raybould detailed “consistent and sustained” efforts to change her mind. Despite repeated assertions by Wilson-Raybould that she would not bend, she told a justice committee on Wednesday the pressure intensified – and included “veiled threats” by aides that she was on course for a clash with the prime minister. She said that while it was proper for ministers and their staff to consult her about protecting jobs, it was inappropriate for her to make decisions based on “partisan political considerations”. Her testimony also marked the first public assertion that Trudeau lobbied her – to the point that she felt obliged to warn him what he was asking was improper. 
She also told parliamentarians she suspected her refusal to back down lay behind her move to the Veterans’ Affairs portfolio in a mid-January cabinet reshuffle.  
What does Trudeau say? 
Trudeau has not denied that he and his team spoke to Wilson-Raybould and her staff about SNC-Lavalin. He says all of their discussions were respectful and within the bounds of the rules. On Thursday, he reiterated his belief that as prime minister, it is his job and duty to protect the jobs of Canadians – likely a reference to the potential for job losses in the event of a conviction.  
Is it a big deal? 
The leader of the opposition, Andrew Scheer, has called on Trudeau to resign –something Trudeau has rejected. Other political leaders have called for more investigations into the affair – and the country’s ethics commissioner is investigating. But at the justice committee hearing on Wednesday, members of Trudeau’s Liberal party appeared as unified; there have been no high-profile shows of public support for Wilson-Raybould within the party since Wednesday. 
What is local media saying? 
 
  Related: Justin Trudeau’s disgrace is like watching a unicorn get run over | Leah McLaren  
 
On Thursday, Wilson-Raybould’s testimony was on the front page of every major paper in the country, with most running large, dramatic photos of the defiant former attorney general. “I Said ‘No’, My Mind Had Been Made Up,” said the National Post. “Wilson-Raybould Speaks Her Truth,” said the Toronto Star. “Wilson-Raybould points accusing finger at PM,” said the Vancouver Sun. And the Globe and Mail, which broke the story, ran with the headline: “An effort to politically interfere.” 
What happens next? 
A number of figures have requested to testify before the justice committee, including Gerald Butts, Trudeau’s former adviser and Michael Wernick, the country’s top public servant. Both were present in many of the discussions – and both have publicly stated previously they did nothing wrong. The prime minister has also said he would consider the future of Wilson-Raybould in the party. While the scandal will likely not damage him in Quebec, where his support of SNC-Lavalin is viewed positively, it could prove damaging in the rest of the country. 
• This article was amended on 4 March 2018 to include a reference to Wilson-Raybould’s change of cabinet portfolio.",2019-03-01 03:19:18+01:00
world/2019/mar/07/justin-trudeau-says-erosion-of-trust-at-centre-of-political-scandal,article,world,World news,2019-03-07 16:57:50+00:00,"Trudeau expresses regret over scandal, but does not apologise",https://www.theguardian.com/world/2019/mar/07/justin-trudeau-says-erosion-of-trust-at-centre-of-political-scandal,"Justin Trudeau has expressed regret for his handling of a political scandal that has cost him two cabinet ministers and a close adviser – but stopped short of apologising, insisting no laws had been broken and that neither he nor his staff had taken any unethical actions. “This has been a tough few weeks,” the Canadian prime minister said on Thursday. “Canadians expect and deserve to have faith in their institutions and the people who act within them … I have taken – and will continue to take – many lessons from these recent days and few weeks.”   Related: Explained: the case that could bring down Canada's Justin Trudeau    Trudeau and his close aides are accused of improperly pressuring the country’s former attorney general Jody Wilson-Raybould to abandon the prosecution of the engineering company SNC-Lavalin, which is alleged to have bribed the Libyan government to secure lucrative construction contracts. He said: “There are conversations that were experienced differently. I regret that.” The firm, which employs 9,000 people in Canada, is based in the province of Québec, where Trudeau’s Liberals need to pick up seats to win a federal election set for October. The scandal has cast a shadow over Trudeau’s domestic image as someone who is committed to transparent government. His conciliatory remarks in front of reporters on Thursday were an attempt to shift public attention away from the scandal. “He’s trying to strike a kind of tone that is reasonable, acknowledging that this could been handled better,” said Lori Turnbull, a professor of political science at Dalhousie University. “[He’s saying] essentially this is a communications issue. This is a political competence issue at worse, but this is not a corruption issue and nobody pushed anybody around.” But the prime minister’s statement did little to placate political rivals. “What we heard from Justin Trudeau was an attempt to justify and normalise corruption. It’s clearer than ever that, inside his government, political interference and contempt for the rule of law are a matter of course,” tweeted the Conservative leader, Andrew Scheer. “This is a PM who has lost the moral authority to govern.” Jagmeet Singh, leader of the leftwing New Democratic party, repeated calls for a full public inquiry into the issue. Trudeau said he had made mistakes and acknowledged an “erosion of trust” between his office and Wilson-Raybould, who was removed from her post as attorney general in January and resigned from the cabinet in mid-February. He denied that his involvement in the case was for partisan or political reasons – but admitted he asked Wilson-Raybould to “revisit her decision” after she told the prime minister’s office it was her intention to proceed with prosecution of the company. His comments also marked the first time the prime minister had directly spoken about the allegations, following the testimony of Wilson-Raybould and the surprise resignation of the Treasury Board president, Jane Philpott, who said she no longer had confidence in the government. Trudeau indicated the two were likely to remain part of the Liberal caucus, despite their public repudiation of the prime minister’s handling of the scandal. Trudeau, typically eager to speak with reporters, cancelled media availability at two events, instead returning to Ottawa for private meetings on how to navigate the troubles facing his government. Gerald Butts, the former principal secretary to the prime minister, testified in front of the parliamentary justice committee on Wednesday and rejected the idea that anyone within Trudeau’s office pressured the attorney general – suggesting he and Wilson-Raybould had divergent interpretations of the same events. Butts, a close friend of Trudeau, resigned from his post shortly after Wilson-Raybould exited cabinet. On Thursday, the prime minister confirmed that SNC-Lavalin’s presence in Québec would be in jeopardy if the government secured a conviction, which would bar it from bidding for federal contracts for a decade. While the government is eager to move forward from the crisis, Wilson-Raybould has expressed interest in returning to the justice committee to further testify – a move the Liberals on the committee have so far blocked. In a statement to media on Wednesday, Wilson-Raybould said  her testimony “was not a complete account but only a detailed summary” and said she looked forward to giving a fuller picture of the events that led to the current political crisis.",2019-03-07 17:57:50+01:00
